es_867,"Capuz de los caballeros rojos. Un símbolo de su devoción a la destrucción de todo mal.\n Efecto(s) de conjunto: PR -2, RM +10"
es_868,"Estas escrituras de mago antiguas contienen el conocimiento mágico del lanzador de hechizos. \nCategoría: Habilidad de nivel 2 (clase)\nEfecto: Invoca una tormenta de hielo que daña a los enemigos a 5 unidades de distancia del lanzador del hechizo.\nRequisito de aprendizaje: \nMago: Nivel 32"
es_869,"Los cristales de tierra provienen de la bendición de la Diosa de la Luna y contienen poderosos atributos de tierra. \n Categoría: Habilidad de nivel 3 (clase) \n Efecto: Aumenta el poder de defensa del objetivo en 6 puntos. No se puede lanzar varias veces sobre el mismo objetivo. \n Requisito de aprendizaje: \n Elfo: Nivel 30"
es_870,"El libro de hechizos de Edin contiene habilidades mágicas elementales. \n Categoría: Habilidad de nivel 1 (común) \n Efecto: Lanza una daga de viento a un enemigo. \n Requisito de aprendizaje: \n Real: Nivel 10 \n Mago: Nivel 4 \n Elfo: Nivel 8 \n Caballero: Nivel 50"
es_871,"Una daga de mithril refinada."
es_872,"Un material raro de alta calidad."
es_873,"Zumo de vómito. Es bastante desagradable al olfato."
es_874,"Este amuleto de destreza está dilapidado y su poder es muy inestable."
es_875,"Los cristales de viento provienen de la bendición de la Diosa de la Luna, que contiene atributos de viento. \n Categoría: Habilidad de nivel 5 (clase) \n Efecto: Probabilidad de disminuir la velocidad de ataque del enemigo durante un periodo de tiempo. \n Requisito de aprendizaje: \n Elfo: Nivel 50"
es_876,"Maíz relleno delicioso. "
es_877,"La cruz dorada de esta capa escarlata es el símbolo del honor y el coraje de un caballero."
es_878,"El código de caballería de los caballeros comprende su honor, su deber y su auténtica fuente de poder. \n Categoría: Habilidad de nivel 2 (clase) \n Efecto: Aumenta la velocidad de evasión. Solo funciona cuando se lleva un escudo. \n Requisito de aprendizaje: \n Caballero: Nivel 50"
es_879,"El libro de hechizos de Edin contiene habilidades mágicas elementales. \n Categoría: Habilidad de nivel 2 (común) \n Efecto: Usa la magia para curar al objetivo y desintoxicar su cuerpo. \n Requisito de aprendizaje: \n Real: Nivel 20 \n Mago: Nivel 8 \n Elfo: Nivel 16"
es_880,"Un ramo de flores."
es_881,"La cadena de malla de un guerrero orco."
es_882,"Estos guanteletes mágicos tienen atributos de agua que fortalecen la recuperación mágica y aumentan la defensa contra ataques de atributos de agua."
es_883,"El libro de hechizos de Edin contiene habilidades mágicas elementales. \n Categoría: Habilidad de nivel 2 (común) \n Efecto: Usa la magia para crear toxinas. Probabilidad de envenenar al objetivo. Seguirá sufriendo daño continuado por las toxinas hasta que el hechizo se desvanezca. \n Requisito de aprendizaje: \n Real: Nivel 20 \n Mago: Nivel 8 \n Elfo: Nivel 16"
es_884,"El enorme rubí está incrustado en el escudo de plata como un ojo malvado."
es_885,"Cuero de calidad animal."
es_886,"El bastón mágico está mejorado con acero. Puede absorber una cantidad considerable de poder mágico de un oponente."
es_887,"Estas escrituras de mago antiguas contienen el conocimiento de poderes mágicos. \n Categoría: Habilidad de nivel 2 (clase) \n Efecto: Crea un círculo de energía que aumenta la velocidad de recuperación de PS+E574 de los jugadores dentro del área de lanzamiento objetivo. \n Requisito de aprendizaje: \n Mago: Nivel 32"
es_888,"El hueso de Scatha es un material raro de alta calidad."
es_889,"Este valioso libro de hechizos contiene conjuros avanzados que otorgan el poder de dioses y demonios. \n Categoría: Habilidad de nivel 6 (común) \n Efecto: Lanza un hechizo que provoca explosiones que infligen daño a un objetivo. \n Requisito de aprendizaje: \n Mago: Nivel 24 \n Elfo: Nivel 48"
es_890,"Una gorra de cuero redonda con un pincho en la parte superior que parece un cuerno.\n Efecto(s) de conjunto: PR -3"
es_891,"Estas escrituras de mago antiguas contienen el conocimiento de poderes mágicos. \n Categoría: Habilidad de nivel 2 (clase) \n Efecto: Usa la magia para crear un muro de fuego que causa daño a los enemigos cuando lo tocan. \n Requisito de aprendizaje: \n Mago: Nivel 32"
es_892,"Esta casaca de cuero ha sido endurecida."
es_893,"Este pergamino mágico está marcado con monstruos."
es_894,"Este libro de hechizos raro proviene de las bendiciones de Teon y contiene conjuros mágicos avanzados. \n Categoría: Habilidad de nivel 4 (clase) \n Efecto: El área de tele+E582transporte establecida por el lanzador del hechizo se puede revisar en la pantalla. \n Requisito de aprendizaje: \n Mago: Nivel 40"
es_895,"Una espada corta de guerreros orcos."
es_896,"Este valioso libro de hechizos contiene conjuros avanzados que otorgan el poder de dioses y demonios. \n Categoría: Habilidad de nivel 6 (común) \n Efecto: Usa un hechizo de fuego para aumentar la FZA 5 puntos. No se puede lanzar varias veces sobre el mismo objetivo. \n Requisito de aprendizaje: \n Mago: Nivel 24 \n Elfo: Nivel 48"
es_897,"¡El misterioso cristal grabado con escrituras antiguas de elfos contiene un sorprendente poder mágico! \n Categoría: Habilidad de nivel 5 (clase) \n Efecto: Probabilidad de evitar que todos los jugadores y PNJ de la pantalla usen la magia durante 16 segundos. \n Requisito de aprendizaje: \n Elfo: Nivel 50"
es_898,"Una llave de habitación de posada ordinaria."
es_899,"La poción mágica verde aumenta temporalmente la velocidad de movimiento durante un periodo de tiempo."
es_900,"¡El misterioso cristal grabado con escrituras antiguas de elfos contiene un sorprendente poder mágico! \n Categoría: Habilidad de nivel 4 (clase) \n Efecto: Invoca un elfo con el mismo atributo que tú. \n Requisito de aprendizaje: \n Elfo: Nivel 40"
es_901,"Esta capa mágica de agua aumenta la recuperación de PM y la resistencia al agua."
es_902,"Una espada de plata refinada que puede infligir daño adicional a los no muertos."
es_903,"Una flecha hecha de oricalco que puede infligir gran daño a los enemigos."
es_904,"¡El misterioso cristal grabado con escrituras antiguas de elfos contiene un sorprendente poder mágico! \nCategoría: Habilidad de nivel 1 (clase) \nEfecto: Aumenta la defensa mágica en un 10%. \nRequisito de aprendizaje: \nElfo: Nivel 10"
es_905,"Esta daga puede infligir daño adicional a los no muertos."
es_906,"Una daga corta pesada."
es_907,"Este yelmo mágico te confiere visión nocturna."
es_908,"Aumenta tu nivel de destreza permanentemente."
es_909,"La poción mágica intensa de la botella puede recuperar una cantidad considerable de PS."
es_910,"Este libro de hechizos raro proviene de las bendiciones de Teon y contiene conjuros mágicos avanzados. \n Categoría: Habilidad de nivel 4 (clase) \n Efecto: Lanza un hechizo de tierra que modifica la topografía de una zona para así poder ralentizar a los enemigos dentro de una unidad de distancia del lanzador objetivo. \n Requisito de aprendizaje: \n Mago: Nivel 40"
es_911,"Un misterioso pergamino con magia que fortalece los objetos con atributos de tierra."
es_912,"Yumi es un arco de hermosa factura con un arqueo ideal para lanzar la flecha con la mayor potencia posible. Se dice que es el arco más perfecto de todo Edin."
es_913,"Un escalofriante hilo de tela de araña con un aura maléfica que se arremolina a su alrededor."
es_914,"Estos valiosos libros mágicos contienen el gran poder de dioses y demonios y registros de habilidades mágicas avanzadas. \n Categoría: Habilidad de nivel 5 (común) \n Efecto: Invoca una momia que emerge del suelo y ataca a tus enemigos. Probabilidad de paralizar al objetivo. \n Requisito de aprendizaje: \n Mago: Nivel 20 \n Elfo: Nivel 40"
es_915,"El anillo de teletransporte está grabado con un misterioso encantamiento que te permite trasladarte a un área determinada que haya sido marcada."
es_916,"Bran encontró este misterioso bastón cuando estaba en el mar."
es_917,"Los experimentos de Nestor han cambiado las habilidades de este bastón."
es_918,"Una capa de bella factura.\n Efecto(s) de conjunto: PR -1, PS +5"
es_919,"Túnica divina de Niviane."
es_920,"Este libro de hechizos raro proviene de las bendiciones de Teon y contiene conjuros mágicos avanzados. \nCategoría: Habilidad de nivel 4 (clase) \nEfecto: Resucita al objetivo muerto y recupera los PS del objetivo, además de un 25% de la experiencia perdida al morir. \nRequisito de aprendizaje: \nMago: Nivel 40"
es_921,"Cristal misterioso grabado con antiguas escrituras de los elfos. ¡Contiene asombrosos poderes mágicos! \nCategoría: Nivel de habilidad 4 (clase)\nEfecto: Probabilidad de reducir la RM del objetivo en un 75%. La RM reducida se recupera después de recibir daño mágico.\nRequisito de aprendizaje: \nElfo: Nivel 40"
es_922,"Un material de placa raro."
es_923,"Este yelmo se construyó con ramitas."
es_924,"La armadura que lleva el Rey Atila en la batalla."
es_925,"Esta piedra contiene una energía misteriosa."
es_926,"Este amuleto de runa especial te hace extraordinariamente fuerte si te lo pones."
es_927,"Pendientes mágicos personalizados refinados y hermosos."
es_928,"Un escudo de plata con encantamientos grabados que te otorga la oportunidad de ser inmune a la paralización."
es_929,"La intensa poción mágica puede aumentar temporalmente la velocidad de movimiento."
es_930,"La sangre de Scatha es un material raro muy solicitado por sus diversos usos."
es_931,"Bran viajó de un lado a otro de Edin con estas botas.\n Efecto(s) de conjunto: Transforma en Bran. PR -4, recuperación de PS -7"
es_932,"El terrible cinturón del troll tiene una calavera mágica que te permite llevar más objetos."
es_933,"Esta armadura, fabricada por herreros elfos, es robusta pero muy ligera."
es_934,"Este cinturón tiene daños, por lo que su poder es muy inestable."
es_935,"Una carta"
es_936,"La poción mágica roja se puede usar para recuperar PS."
es_937,"Este valioso pergamino te ayudará a fortalecer y mejorar tus armas."
es_938,"Aunque no parece tan poderosa como su hacha, la espada corta de los enanos es igual de fuerte y E630 mortal."
es_939,"Esta capa mágica de agua aumenta la recuperación de PM y la resistencia al viento."
es_940,"Esta túnica está confeccionada con hilo mágico."
es_941,"Esta casaca fue robada después de ser creada. Tiene runas talladas. Por cada nivel de fortificación, aumenta la resistencia a la magia +1."
es_942,"Una malla de acera resistente."
es_943,"Este valioso libro de hechizos contiene conjuros avanzados que otorgan el poder de dioses y demonios. \n Categoría: Habilidad de nivel 6 (común) \n Efecto: Destruye a tus enemigos con el poder de la tierra, infligiendo un gran daño al objetivo. \n Requisito de aprendizaje: \n Mago: Nivel 24 \n Elfo: Nivel 48"
es_944,"Este casco mágico te permite lanzar hechizos de intermedios elementales e mayor después de ponértelo."
es_945,"El arma preferida de los pescadores."
es_946,"El bastón mágico personalizado te permite absorber los poderes mágicos de los enemigos."
es_947,"¡El misterioso cristal grabado con escrituras antiguas de elfos contiene un sorprendente poder mágico! \n Categoría: Habilidad de nivel 1 (clase) \n Efecto: Convierte 8 puntos de tus PS en 2 puntos de PM. \n Requisito de aprendizaje: \n Elfo: Nivel 10"
es_948,"Estos guanteletes mágicos fortalecen tus objetos."
es_949,"Se dice que los cuernos de Pan son la fuente de sus poderes mágicos."
es_950,"Una espada corta muy ágil que usan los elfos. Inflige daño adicional a los no muertos."
es_951,"Alas de elfo bendecidas. Cuando las llevas puestas, te devuelven al Bosque élfico."
es_952,"El libro de hechizos de Edin contiene habilidades mágicas elementales. \n Categoría: Habilidad de nivel 1 (común) \n Efecto: Lanza flechas de hielo a los enemigos y los hiere. \n Requisito de aprendizaje: \n Real: Nivel 10 \n Mago: Nivel 4 \n Elfo: Nivel 8 \n Caballero: Nivel 50"
es_953,"Un cristal raro y transparente."
es_954,"Este libro de hechizos raro proviene de las bendiciones de Teon y contiene conjuros mágicos avanzados. \n Categoría: Habilidad de nivel 4 (clase) \n Efecto: Probabilidad de cambiar el arma del lanzador del hechizo por un arma mágica +1 una vez. No se puede repetir en la misma arma. \n Requisito de aprendizaje: \n Mago: Nivel 40"
es_955,"Piel mullida de Cerbero."
es_956,"Este cinturón fortalece la recuperación mágica y física."
es_957,"Este cinturón tiene daños, por lo que su poder es muy inestable."
es_958,"Una esmeralda ordinaria."
es_959,"Una capa mágica rara que fortalece la recuperación mágica."
es_960,"Un excelente tejido azul."
es_961,"Los cristales de viento provienen de la bendición de la Diosa de la Luna, que contiene atributos de viento. \nCategoría: Habilidad de nivel 5 (clase) \nEfecto: Disminuye 1 punto la frecuencia de impacto a distancia, pero aumenta 5 puntos los ataques a distancia Requisito de aprendizaje: \nElfo: Nivel 50"
es_962,"Un mapa del terreno."
es_963,"El cinturón está rodeado por un aura de muerte. "
es_964,"Puede fortalecer tu recuperación de PM."
es_965,"El fragmento de espíritu roto."
es_966,"Un pequeño montón de polvo. Nadie sabe de qué está hecho."
es_967,"Una escama ordinaria."
es_968,"Combustible para una lámpara."
es_969,"Este libro de hechizos raro de Edin contiene habilidades mágicas intermedias. \nCategoría: Habilidad de nivel 3 (común) \nEfecto: Disminuye 3 puntos de PR. No puedes volver a lanzarlo varias veces. \nRequisito de aprendizaje: \nMago: Nivel 12 \nElfo: Nivel 24"
es_970,"¡El misterioso cristal grabado con escrituras antiguas de elfos contiene un sorprendente poder mágico! \n Categoría: Habilidad de nivel 2 (clase) \n Efecto: Aumenta la constitución en 3 puntos. El hechizo no se puede repetir. \n Requisito de aprendizaje: \n Elfo: Nivel 20"
es_971,"Un lanza élfica resistente. Inflige daño adicional a los no muertos."
es_972,"Armadura del caballero valiente - Zapatas de hierro.\n Efecto(s) de conjunto: PR -3"
es_973,"La poción mágica blanca ayuda a recuperar PS. "
es_974,"Escudo grande tosco."
es_975,"Este libro de hechizos raro de Edin contiene habilidades mágicas intermedias. \n Categoría: Habilidad de nivel 3 (común) \n Efecto: Provoca daños con relámpagos a los enemigos que están de frente en línea recta. \n Requisito de aprendizaje: \n Mago: Nivel 12 \n Elfo: Nivel 24"
es_976,"Un escudo tosco y grueso.\n Efecto(s) de conjunto: PR -1, PS +5"
es_977,"Un escudo de madera viejo."
es_978,"Un arco de madera refinada fabricado por un habilidoso artesano elfo."
es_979,"El tomo secreto contiene el conocimiento de todos los reyes desde el origen de los tiempos. \nCategoría: Habilidad de nivel 2 (clase) \nEfecto: Te teletransporta junto a un miembro específico del mismo gremio. \nRequisito de aprendizaje: \nReal: Nivel 45"
es_980,"Este valioso libro de hechizos contiene conjuros avanzados que otorgan el poder de dioses y demonios. \n Categoría: Habilidad de nivel 5 (común) \n Efecto: Lanza púas de hielo al objetivo. \n Requisito de aprendizaje: \n Mago: Nivel 20 \n Elfo: Nivel 40"
es_981,"Un escudo de hierro grabado con encantamientos antiguos.\n Efecto(s) de conjunto: PR -3"
es_982,"Chaqueta de cuero suave."
es_983,"El libro de hechizos de Edin contiene habilidades mágicas elementales. \n Categoría: Habilidad de nivel 2 (común) \n Efecto: Aumenta el valor de ataque del arma objetivo en 2 puntos. \n Requisito de aprendizaje: \n Real: Nivel 20 \n Mago: Nivel 8 \n Elfo: Nivel 16"
es_984,"Una llave brillante preciosa."
es_985,"Chaleco de cuero suave.\n Efecto(s) de conjunto: PR -3"
es_986,"Gorra redonda de cuero suave.\n Efecto(s) de conjunto: PR -3"
es_987,"Aumenta tu fuerza permanentemente."
es_988,"Estas escrituras de mago antiguas contienen el conocimiento de poderes mágicos. \n Categoría: Habilidad de nivel 1 (clase) \n Efecto: Invoca a monstruos para que luchen por ti. El número de monstruos invocado depende del nivel de carisma del lanzador del hechizo. Este nivel afecta al tipo de monstruos que se invoca. \n Requisito de aprendizaje: \n Mago: Nivel 28"
es_989,"Este libro de hechizos raro de Edin contiene habilidades mágicas intermedias. \n Categoría: Habilidad de nivel 4 (común) \n Efecto: Lanza gigantes espinas subterráneas con este hechizo de tierra que acuchillan a los enemigos dentro de 1 unidad de distancia del objetivo. \n Requisito de aprendizaje: \n Mago: Nivel 16 \n Elfo: Nivel 32"
es_990,"Yelmo de cuero suave."
es_991,"Este amuleto mágico aumenta la destreza."
es_992,"Los cristales de fuego provienen de la bendición de la Diosa de la Luna, que contiene atributos de fuego. \nCategoría: Habilidad de nivel 5 (clase) \nEfecto: Maximiza el valor de ataque del arma a corta distancia del lanzador del hechizo durante un periodo de tiempo. \nRequisito de aprendizaje: \nElfo: Nivel 50"
es_993,"Los caballeros oscuros son los ejecutores de la tiranía del Rey Atila. Esta espada es el símbolo de un caballero oscuro."
es_994,"Este valioso libro de hechizos contiene conjuros avanzados que otorgan el poder de dioses y demonios. \nCategoría: Habilidad de nivel 6 (común) \nEfecto: Este hechizo tiene una probabilidad de reducir el valor de ataque físico a corta distancia y la frecuencia de impacto del objetivo. \nRequisito de aprendizaje: \nMago: Nivel 24 \nElfo: Nivel 48"
es_995,"Un huevo desconocido. Al menos sabemos que es saludable."
es_996,"Por estar fabricado de oricalco, no recibe daños nunca y provoca daño adicional a los no muertos."
es_997,"Este cinturón aumenta la recuperación de PS."
es_998,"Este anillo mágico especial aumenta la defensa contra ataques de atributos de viento."
es_999,"Este libro de hechizos raro proviene de las bendiciones de Teon y contiene conjuros mágicos avanzados. \n Categoría: Habilidad de nivel 3 (clase) \n Efecto: Probabilidad de hacer que los enemigos dentro de una unidad de distancia caigan dormidos durante 32 segundos. Los enemigos se despertarán si los atacas. \n Requisito de aprendizaje: \n Mago: Nivel 36"
es_1000,"Un rubí perfecto. "
es_1001,"Una brillante escama de dragón de agua"
es_1002,"Este libro de hechizos raro de Edin contiene habilidades mágicas intermedias. \n Categoría: Habilidad de nivel 4 (común) \n Efecto: Probabilidad de causar daños al arma del oponente. \n Requisito de aprendizaje: \n Mago: Nivel 16 \n Elfo: Nivel 32"
es_1003,"Cada fragmento de plata incrustado en esta capa oscura está grabado con encantamientos mágicos que fortalecen la recuperación mágica."
es_1004,"Este anillo especial aumenta la resistencia a la tierra."
es_1005,"Parece que este tejido puede absorber el daño mágico."
es_1006,"En esta agua pura se encuentra un misterioso poder. "
es_1007,"Estos libros de hechizos raros proviene de las bendiciones de Teon y contienen conjuros mágicos avanzados. \nCategoría: Habilidad de nivel 3 (clase) \nEfecto: Provoca que el enemigo no pueda usar ninguna poción durante un periodo de tiempo. \nRequisito de aprendizaje: \nMago: Nivel 36"
es_1008,"Una placa de plata brillante."
es_1009,"Los cristales de fuego provienen de la bendición de la Diosa de la Luna, que contiene atributos de fuego. \n Categoría: Habilidad de nivel 5 (clase) \n Efecto: Permite al lanzador del hechizo recuperar PS y poder mágico aunque esté sobrecargado de objetos. \n Requisito de aprendizaje: \n Elfo: Nivel 50"
es_1010,"Estas escrituras de mago antiguas contienen el conocimiento de poderes mágicos. \n Categoría: Habilidad de nivel 1 (clase) \n Efecto: Aumenta la velocidad del lanzador del hechizo en un 50% durante un período de 30 minutos. Volver a lanzarlo no acumula los efectos del hechizo. \n Requisito de aprendizaje: \n Mago: Nivel 28"
es_1011,"Un hilo de mithril refinado."
es_1012,"Botas terrestres cómodas."
es_1013,"Los cristales de fuego provienen de la bendición de la Diosa de la Luna, que contiene atributos de fuego. \nCategoría: Habilidad de nivel 5 (clase) \nEfecto: Aumenta el valor de ataque a corta distancia del lanzador del hechizo en 6 puntos. \nRequisito de aprendizaje: \nElfo: Nivel 50"
es_1014,"Una escama de dragón de viento "
es_1015,"Los cristales de agua provienen de la bendición de la Diosa de la Luna y contienen atributos de agua. \n Categoría: Habilidad de nivel 4 (clase) \n Efecto: Aumenta la velocidad de recuperación de PS del objetivo. Cuanto mayor sea el nivel, mayor será la cantidad de recuperación hasta un máximo de 15. \n Requisito de aprendizaje: \n Elfo: Nivel 40"
es_1016,"Este libro de hechizos raro de Edin contiene habilidades mágicas intermedias. \n Categoría: Habilidad de nivel 3 (común) \n Efecto: Probabilidad de cegar al objetivo durante un periodo de tiempo. \n Requisito de aprendizaje: \n Mago: Nivel 12 \n Elfo: Nivel 24"
es_1017,"Estas escrituras de mago antiguas contienen el conocimiento de poderes mágicos. \n Categoría: Habilidad de nivel 1 (clase) \n Efecto: Probabilidad de causar enfermedad al enemigo, lo que reduce su defensa en 12 puntos y su frecuencia de impacto en 6+E728 puntos. \n Requisito de aprendizaje: \n Mago: Nivel 28"
es_1018,"Malla de escamas robusta."
es_1019,"Un material raro de alta calidad."
es_1020,"El amuleto de esqueleto fabricado con huesos de diferentes criaturas."
es_1021,"Esta alabarda tiene pinchos que la hacen más letal."
es_1022,"El ala dorada de la reina hormiga gigante tiene un gran poder de defensa mágica."
es_1023,"Los cristales de fuego provienen de la bendición de la Diosa de la Luna, que contiene atributos de fuego. \n Categoría: Habilidad de nivel 4 (clase) \n Efecto: Aumenta 4 puntos tu valor de ataque físico y el de los miembros de tu equipo. \n Requisito de aprendizaje: \n Elfo: Nivel 40"
es_1024,"Un arma que puede aplastar la cabeza de tu enemigo con facilidad."
es_1025,"Malla de placa de hierro robusta."
es_1026,"Esto hace que tu cuerpo sea fuerte y saludable."
es_1027,"Una de las 13 obras maestras del maestro herrero elfos. Esta armadura, fabricada con el resistente oricalco, es incomparable."
es_1028,"Un trozo de corteza."
es_1029,"Un fragmento brillante de platino."
es_1030,"Armadura de cuero suave."
es_1031,"Las flechas de mithril provocan un gran daño."
es_1032,"El código de caballería de los caballeros comprende habilidades de combate, cómo deben actuar y su auténtica fuente de poder. \n Categoría: Habilidad de nivel 1 (clase) \n Efecto: Probabilidad de provocar mareo al enemigo. Solo funciona con una espada a dos manos. \n Requisito de aprendizaje: \n Caballero: Nivel 50"
es_1033,"El código de caballería de los caballeros comprende habilidades de combate, cómo deben actuar y su auténtica fuente de poder. \n Categoría: Habilidad de nivel 1 (clase) \n Efecto: Reduce la PR y el daño recibido. Cuanto mayor sea el nivel, mayor la cantidad de daño reducido. \n Requisito de aprendizaje: \n Caballero: Nivel 50"
es_1034,"Un caparazón de escorpión."
es_1035,"Un cinturón de ogro ancho."
es_1036,"Malla de hierro tosca."
es_1037,"Colmillos horribles de hombres lobo debilitados. \nObjeto de misión"
es_1038,"Esta piedra hace funcionar el reloj de sol. \nObjeto de misión"
es_1039,"Un fragmento de piedra del tiempo que hace funcionar el reloj de sol. \nObjeto de misión"
es_1040,"La poción de dios ilumina con luz y tiene un aroma que reconforta el alma. \nObjeto de misión"
es_1041,"Una pluma de arpía debilitada que te proporciona la habilidad de volar. \nObjeto de misión"
es_1042,"Comida que adoran los osobúhos debilitados. \nObjeto de misión"
es_1043,"Deliciosa galleta de vainilla. \nObjeto de misión"
es_1044,"Las raíces de esta planta tienen efectos curativos. \nObjeto de misión"
es_1045,"Poción curativa de Leah con fantásticos efectos de curación. \nObjeto de misión"
es_1046,"Cajas de almacenamiento de Justina. \nObjeto de misión"
es_1047,"Cajas de la armadura robada de Leah. \nObjeto de misión"
es_1048,"Una espada rota con la que puedes fabricar un arma poderosa. \nObjeto de misión"
es_1049,"Un cristal de alma de monstruo. \nObjeto de misión"
es_1050,"Pellejo de lobo suave. \nObjeto de misión"
es_1051,"Repugnante sangre de necrófago.\nObjeto de misión"
es_1052,"Piel de cazador confeccionada después de una cacería.  \nObjeto de misión"
es_1053,"Fragmentos de huesos esparcidos."
es_1054,"Una pluma de grifo ligera. "
es_1055,"El espíritu del polvo bendecido y refinado."
es_1056,"Misterioso disolvente refinado por un alquimista que se puede usar para muchas cosas."
es_1057,"Se dice que,+E747 después de recoger un determinado número de estas raras insignias en Edin, podrás intercambiarlas por objetos exclusivos.\nObjeto de misión"
es_1058,"Sandalias elaboradas con cuero tachonado.\n Efecto(s) de conjunto: PR -3"
es_1059,"Una placa rara que se tarda años en fabricar.\nObjeto de misión"
es_1060,"La placa del inframundo es muy rara en Edin.\nObjeto de misión"
es_1061,"Estos escalofriantes huesos de los muertos portan su espantoso poder. \nObjeto de misión"
es_1062,"El cuero manchado de sangre tiene unos números extraños que parecen coordenadas. \n(X:32758)\nObjeto de misión"
es_1063,"El cuero manchado de sangre tiene unos números extraños que parecen coordenadas. \n(Y:32745)\nObjeto de misión"
es_1064,"La médula ósea del mago esqueleto tiene un aura de muerte.\nObjeto de misión"
es_1065,"¡Un cristal de alma divino con un aura poderosa!\nObjeto de misión"
es_1066,"Un corazón de gólem aterrador.\nObjeto de misión"
es_1067,"Este cristal de alma está relleno del malvado poder de las almas de los muertos.\nObjeto de misión"
es_1068,"Este mapa detalla la mazmorra de la Isla Prometida (primer y segundo nivel). \n Coordenadas (32678, 32726).\nObjeto de misión"
es_1069,"Escrituras encontradas en los túneles. \nObjeto de misión"
es_1070,"Contiene energía de poder misteriosa.\nObjeto de misión"
