es_499,"Hoja de esperanza de paz. "
es_500,"Un par de guanteletes de cuero fabricados por un artesano elfo."
es_501,"Equipar este yelmo permite usar encantamiento poderoso, crear arma mágica y detección."
es_502,"¡El misterioso cristal grabado con escrituras antiguas de elfos contiene sorprendentes poderes mágicos! \n Categoría: Habilidad de nivel 4 (clase) \n Efecto: Probabilidad de reducir la PR del objetivo un 50%% en función de tu propio nivel.  \n Requisito de aprendizaje: \n Elfo: Nivel 40"
es_503,"Es un bastón horrible que puede confundir a las personas. Beleth experimentó la tentación del bastón cuando practicaba magia oscura en secreto y se volvió extremadamente malvado. Aumentará la recuperación de PM.  "
es_504,"Para luchar contra la invasión de los orcos, el maestro herrero elfo encontró este material precioso en la colina del Draco y consiguió forjar el Perforador de malla, que inflige daño adicional a los no muertos."
es_505,"Pergamino misterioso con un extraordinario poder que puede fortalecer objetos de fuego. "
es_506,"Crujiente, delicioso y nutritivo, y mejora la circulación sanguínea después de comerlo. "
es_507,"Las botas de aventuras fantásticas permiten respirar con libertad debajo del agua."
es_508,"Un farol normal que puede iluminar grandes áreas."
es_509," La capa está hecha de piel de aceite que la hace extremadamente duradera."
es_510,"El tomo real contiene los registros del conocimiento de todos los reyes. \n Categoría: Habilidad de nivel 1 (clase) \n Efecto: Invoca miembros del mismo gremio a tu posición actual. \n Requisito de aprendizaje: \n Real: Nivel 30 "
es_511,"Una llave de cobre."
es_512,"Esmeralda de alta calidad."
es_513,"Una fruta con forma curva y pulpa suave. Te permite aliviar la presión y mantener la calma. "
es_514,"Collar de mascota para mascotas domesticadas."
es_515,"Aumenta eternamente tu constitución después de usarlo."
es_516,"El anillo mágico especial con el corazón azul del agua aumenta la defensa contra los ataques de agua cuando se lleva puesto."
es_517,"Zafiro perfecto."
es_518,"Diamante ordinario."
es_519,"La daga con la bendición de la magia de la suerte tiene la probabilidad de infligir gran daño al objetivo."
es_520,"Este raro registro de mago tiene propiedades mágicas. \n Categoría: Habilidad de nivel 2 (clase) \n Efecto: Resucita al objetivo muerto y recupera por completo los PS del mismo. \n Requisito de aprendizaje: \n Mago: Nivel 32"
es_521,"Las piedras de cristal provienen de la bendición de la Diosa de la Luna, que posee atributos de agua. \n Categoría: Habilidad de nivel 5 (clase) \n Efecto: Tiene una probabilidad de reducir en un 50%% el efecto de curación de un objetivo durante un tiempo. \n Requisito de aprendizaje: \n Mago: Nivel 50"
es_522,"Un yelmo de hierro ordinario."
es_523,"Un hacha de plata refinada. Inflige daño adicional a los no muertos."
es_524,"Aunque Camelot ya no existe, la gente sigue teniendo esperanza de encontrar una nueva era para el reino."
es_525,"Esta antigua escritura de mago rara tiene poderes mágicos. \n Categoría: Habilidad de nivel 2 (clase) \n Efecto: Resucita a los muertos y recupera por completo sus PS. \n Requisito de aprendizaje: \n Mago: Nivel 32 "
es_526,"Una vela ordinaria que ilumina un área pequeña"
es_527,"El deslumbrante y brillante anillo de oro aumenta la RM cuando se lleva puesto. "
es_528,"Vino de fruta con un sabor añejo y puro, elaborado a través de un proceso natural de fermentación. "
es_529,"El cristal de viento recibió las bendiciones de la Diosa de la Luna, lo que le otorga ágiles atributos de viento. \n Categoría: Habilidad de nivel 4 (clase) \n Efecto: Aumenta la frecuencia de impacto de ataques largos en 2 puntos y el daño de ataques largos en 3 puntos para ti y los miembros del equipo. \n Requisito de aprendizaje: \n Elfo: Nivel 40"
es_530,"La flecha elaborada a partir de los diseños ancestrales."
es_531,"Bafomet cayó en la oscuridad cuando practicaba magia oscura. Mientras se transformaba, se cortó los cuernos de su cabeza y los convirtió en un bastón. Se podría lanzar hechizos después de equipar este objeto."
es_532,"Una alabarda poderosa. "
es_533,"Galahad ha muerto. Se ha convertido en el caballero de la muerte con el yelmo de colmillos.\n Efecto(s) de conjunto: Transforma en un caballero de la muerte. PR -4, recuperación de PS -7"
es_534,"El tomo secreto real registra todas las actividades del rey. Puedes aprender de ellas. \n Categoría: Habilidad de nivel 2 (clase) \n Efecto: Aumenta el ataque físico en 5 puntos para ti y los miembros de tu equipo. \n Requisito de aprendizaje: \n Real: Nivel 50"
es_535,"Al elfo que ama la naturaleza le gusta la capa élfica verde oscura, como cabe esperar."
es_536,"Un viejo yelmo amarillo con dos cuernos en la parte superior.\n Efecto(s) de conjunto: PR -1, PS +5"
es_537,"El diseño de esta ballesta se basa en un antiguo diseño."
es_538,"El yelmo élfico de la destreza con bendiciones de la Diosa de los Elfos."
es_539,"¡Los cobardes no son dignos de recibir el honorable título de caballero! \n Código de los caballeros de caballería."
es_540,"La cadena de malla élfica es ligera y práctica en comparación con la de mithril."
es_541,"Armadura cómoda de cuero de novicio."
es_542,"Armadura de madera ligera endurecida."
es_543,"Daño mágico +3\nOriginalmente, solo era un bastón de madera ordinario y marchito, pero después de haber sido teñido con sangre mágica de una serpiente gigante de oro, pasó a poseer una magia poderosa."
es_544,"Una lanza poderosa."
es_545,"Los guanteletes de lana fabricados con seda de oro tienen una mayor resistencia contra el frío. "
es_546,"El color azul cerúleo del zafiro perfecto es como mirar el cielo o el mar."
es_547,"Cada paso que da el caballero de la muerte provoca la desesperación de la gente.\n Efecto(s) de conjunto: Transforma en un caballero de la muerte. PR -4, recuperación de PS -7"
es_548,"Este líquido de salvación mágico puede resucitar a los muertos."
es_549,"La parte superior de este peto es de acero, mientras la parte inferior está compuesta de cadena de malla. "
es_550,"Escudo de cuero de novicio endurecido."
es_551,"¡Los misteriosos cristales grabados con escrituras antiguas de elfos contienen sorprendentes poderes mágicos! \n Categoría: Habilidad de nivel 2 (clase) \n Efecto: Fortalece el poder defensivo de todos los atributos del lanzador del hechizo en un 10%%. \n Requisito de aprendizaje: \n Elfo: Nivel 20"
es_552,"El raro libro de hechizos de Edin tiene habilidades mágicas intermedias. \n Categoría: Habilidad de nivel 3 (común) \n Efecto: Puede recuperar los PS de un objetivo y causar daño a los no muertos. \n Requisito de aprendizaje: \n Mago: Nivel 12 \n Elfo: Nivel 24"
es_553,"El amuleto de carisma tiene un poder inestable. "
es_554,"El yelmo élfico de la constitución ha sido bendecido por la Diosa de los Elfos."
es_555,"El anillo de oro tiene una fuerte defensa mágica."
es_556,"Los registros de mago antiguos contienen extrañas anotaciones. \n Categoría: Habilidad de nivel 1 (clase) \n Efecto: Inflige daño a un objetivo y tiene una probabilidad de congelarlo durante 10 segundos; el objetivo congelado no podrá recibir ataques de nadie y tampoco podrá moverse. \n Requisito de aprendizaje: \n Mago: Nivel 28 "
es_557,"Un hacha ordinaria. "
es_558,"La espada corta de hechizos con bendiciones de los elfos inflige daño adicional a los no muertos. "
es_559,"Una flecha hecha de oro que puede infligir gran daño. "
es_560,"Un anillo de gema para novicio."
es_561,"La espada corta de la destreza con bendiciones de los elfos inflige daño adicional a los no muertos."
es_562,"Guanteletes mágicos con poderes de la tierra que fortalecen la recuperación de PM y aumentan la defensa contra ataques de tierra."
es_563,"Una llave de madera marrón grisácea. "
es_564,"Los patrones que tiene grabados en la hoja le permiten moverse con libertad,+E255 naturalidad y una extraordinaria elegancia. "
es_565,"Esta fruta tiene la piel áspera y una pulpa dulce. Te mantiene joven y enérgico después de comerla. "
es_566,"¡Justicia! Espada larga noble que no puede ser contaminada por el mal. Inflige daño adicional a los no muertos."
es_567,"La capa mágica del Templo de Nieve está grabada con las runas mágicas del teletransporte."
es_568,"Un montón de cristales plateados."
es_569,"El hacha de batalla de doble curva. Es el símbolo de un espíritu intrépido y alocado. Si te equipas con este objeto tendrás más velocidad, pero recibirás daño adicional del enemigo."
es_570,"Diamante de alta calidad."
es_571,"Un escudo de hueso escalofriante.\n Efecto(s) de conjunto: PR -2, PS +10"
es_572,"Un amuleto bendecido de la Isla Prometida."
es_573,"¡Este misterioso cristal está grabado con escrituras antiguas de elfos que le confieren poderes mágicos! \n Categoría: Habilidad de nivel 1 (clase) \n Efecto: El lanzador del hechizo puede teletransportarse al Árbol del Mundo. \n Requisito de aprendizaje: \n Mago: Nivel 40"
es_574,"Un montón de mithril oscuro y E266áspero"
es_575,"Un libro de hechizos raro de las bendiciones de Teon que contiene el poder de hechizos mágicos avanzados. \n Categoría: Habilidad de nivel 4 (clase) \n Efecto: Aumenta un 20% los PS del objetivo y el valor máximo de PM durante un periodo de tiempo. Los efectos desaparecen al volver a iniciar sesión. \n Requisito de aprendizaje: \n Mago: Nivel 40"
es_576,"El brillante y puro diamante perfecto."
es_577,"Una luz ordinaria que ilumina un área de tamaño medio."
es_578,"La poción mágica azul de la botella puede acelerar la velocidad de recuperación de PM."
es_579,"¡El misterioso pergamino contiene un poder mágico proveniente de un dios! Puede fortalecer objetos con atributos de viento."
es_580,"La afilada garra de Scatha es un material raro de alta calidad. "
es_581,"Guanteletes de cuero ordinarios."
es_582,"Una gran espada afilada con un poder sobrecogedor."
es_583,"Un cinturón de hierro ordinario con hechicería de protección.\n Efecto(s) de conjunto: PR -3"
es_584,"Este valioso libro de hechizos contienen conjuros de dioses y demonios. \n Categoría: Habilidad de nivel 6 (común) \n Efecto: Convierte el cadáver objetivo en un zombi que seguirá y ayudará al lanzador del hechizo. \n Requisito de aprendizaje: \n Mago: Nivel 24 \n Elfo: Nivel 48"
es_585,"Una llave negra."
es_586,"Esencia de alma de gólem."
es_587,"¡El cristal de tierra originado a partir de las bendiciones de la Diosa de la Luna contiene atributos de tierra! \n Categoría: Habilidad de nivel 4 (clase) \n Efecto: Probabilidad de hacer que el oponente no pueda atacar a ningún objetivo durante 6 segundos.\n Requisito de aprendizaje: \n Elfo: Nivel 40"
es_588,"Un collar de gemas mágico que ilumina en la oscuridad."
es_589,"Una daga ordinaria que se puede usar y portar con facilidad."
es_590,"Una flecha hecha de mithril oscuro que puede infligir gran daño."
es_591,"La placa de malla está fabricada con cristales suaves de azur."
es_592,"Un libro de hechizos raro que proviene de Teon y contiene el poder de hechizos mágicos avanzados. \n Categoría: Habilidad de nivel 4 (clase) \n Efecto: Busca monstruos y jugadores ocultos en la pantalla, los hace visibles y les causa daños. \n Requisito de aprendizaje: \n Mago: Nivel 36"
es_593,"Este precioso pergamino puede fortalecer accesorios."
es_594,"Piel de animal suave."
es_595,"Carne fresca."
es_596,"Un arco largo ordinario."
es_597,"Esta piedra especial puede recuperar armas dañadas."
es_598,"El pergamino mágico antiguo está lleno de encantamientos extraños que pueden destruir armaduras."
es_599,"Una lanza larga con pico de cuervo y púas afiladas."
es_600,"Originalmente fue una herramienta para la agricultura, pero pronto se convirtió en un arma letal tras una elaboración cuidadosa."
es_601,"Este amuleto de la sabiduría tiene daños y contiene un poder muy inestable."
es_602,"¡El cristal de viento originado a partir de las bendiciones de la Diosa de la Luna contiene ágiles atributos de viento! \n Categoría: Habilidad de nivel 3 (clase) \n Efecto: Aumenta la velocidad de movimiento del lanzador del hechizo durante un periodo de tiempo. \n Requisito de aprendizaje: \n Elfo: Nivel 30"
es_603,"¡El cristal de agua originado a partir de las bendiciones de la Diosa de la Luna contiene atributos de agua! \n Categoría: Habilidad de nivel 5 (clase) \n Efecto: Recupera un determinado valor de PS a los miembros del equipo. \n Requisito de aprendizaje: \n Elfo: Nivel 50"
es_604,"Este libro de hechizos raro proviene de las bendiciones de Teon y contiene el poder de hechizos mágicos avanzados. \n Categoría: Habilidad de nivel 4 (clase) \n Efecto: Invoca una bayoneta gigante fabricada a partir de la luz de los cielos para acuchillar a tu objetivo, lo que le provoca un daño irreparable. \n Requisito de aprendizaje: \n Mago: Nivel 40"
es_605,"Una espada corta de hierro ordinaria."
es_606,"Este libro de hechizos de Edin contiene habilidades mágicas elementales. La clase de mago consume 0 de maná al lanzar este hechizo por debajo del nivel 30. Las clases elfo y real consumen 0 de maná al lanzar este hechizo por debajo del nivel 20.\n Categoría: Habilidad de nivel 1 (común) \n Efecto: Lanza una fecha mágica que inflige daño al objetivo. \n Requisito de aprendizaje: \n Real: Nivel 10 \n Mago: Nivel 4 \n Elfo: Nivel 8 \n Caballero: Nivel 50"
es_607,"Un trozo de mithril."
es_608,"El código de la caballería incluye habilidades de combate, cómo deben actuar y su auténtica fuente de poder.\nCategoría: Nivel de habilidad 2 (clase)\nEfecto: Probabilidad de reflejar el daño de ataque físico hacia el atacante. Solo funciona con una espada a dos manos.\nRequisito de aprendizaje:\nCaballero: Nivel 50"
es_609,"Este libro de hechizos de Edin contiene habilidades mágicas elementales. \n Categoría: Habilidad de nivel 1 (común) \n Efecto: Puede recuperar algunos PS y causar daño a los no muertos. \n Requisito de aprendizaje: \n Real: Nivel 10 \n Mago: Nivel 4 \n Elfo: Nivel 8 \n Caballero: Nivel 20"
es_610,"Licor fuerte destilado elaborado con granos como la cebada. Sabe rico y meloso."
es_611,"Se trata de una preciosa llave de oro brillante."
es_612,"Armadura del caballero valiente - Visera de hierro.\n Efecto(s) de conjunto: PR -3"
es_613,"La escama de Scatha es un material raro de alta calidad. "
es_614,"Armadura del caballero valiente - Escudo de hierro.\n Efecto(s) de conjunto: PR -3"
es_615,"La Capuz de un caballero."
es_616,"Daño mágico +5\nEste bastón de mago antiguo puede proteger a su maestro."
es_617,"Esta armadura de cuero tiene hombreras con púas."
es_618,"Puede atacar e infligir daño a los que llevan armadura de acero, y les causa heridas considerables+E308. "
es_619,"Este pergamino antiguo puede resucitar a los muertos."
es_620,"Una deliciosa galleta élfica. Otorga efecto de aceleración de elfo de nivel 2."
es_621,"Esta espada corta de la constitución fue bendecida por los elfos. Inflige daño adicional a los no muertos. "
es_622,"Los metales refinados de alta calidad."
es_623," Estas escrituras de mago antiguas contienen el conocimiento de poderes mágicos. \n Categoría: Habilidad de nivel 1 (clase) \n Efecto: Bendecido por el poder divino, la velocidad de movimiento del lanzador del hechizo aumenta. \n Requisito de aprendizaje: \n Mago: Nivel 28"
es_624,"No existe arma que Nestor no pueda usar, ni siquiera esta hoja vinculada única. Puede causar daño adicional a los muertos."
es_625,"Un instrumento musical tradicional de Edin."
es_626,"Estas escrituras de mago antiguas tienen poderes mágicos. \n Categoría: Habilidad de nivel 2 (clase) \n Efecto: Hace invisible al lanzador del hechizo, pero el efecto desaparecerá de inmediato cuando este ataque. \n Requisito de aprendizaje: \n Mago: Nivel 32"
es_627,"El tomo secreto real contiene todo el conocimiento de los reyes desde el principio.\nCategoría: Nivel de habilidad 1 (clase)\nEfecto: Marca a un objetivo no aliado durante 45 segundos, revelando así su ubicación a los aliados del lanzador. Los objetivos marcados reciben daño adicional de los ataques.\nRequisito de aprendizaje:\nReal: Nivel 15"
es_628,"Tiene encantamientos misteriosos grabados en su interior que te permiten cambiar t+E316u apariencia."
es_629,"La escama del dragón de la tierra contiene el poder de la tierra. "
es_630,"Este libro de hechizos raro de Edin contiene hechizos intermedios. \n Categoría: Habilidad de nivel 3 (común) \n Efecto: Emite un fuerte ataque de hielo frío que inflige daño de hielo a los enemigos en un área reducida. \n Requisito de aprendizaje: \n Mago: Nivel 12 \n Elfo: Nivel 24"
es_631,"Un fragmento de oro tosco. "
es_632,"Botas de Beleth. Están creadas con fina artesanía. "
es_633,"Su ala blanca es brillante y posee un gran poder defensivo. También aumenta la recuperación de PM. "
es_634,"El escudo con pincho proporciona una buena defensa. Su pincho hace que los enemigos se lo piensen dos veces antes de atacar.\n Efecto(s) de conjunto: AC -3"
es_635,"Estas escrituras de mago antiguas tienen poderes mágicos. \n Categoría: Habilidad de nivel 2 (clase) \n Efecto: Tiene una probabilidad de encerrar mágicamente al oponente e impide que pueda usar la magia durante un periodo de tiempo. \n Requisito de aprendizaje: \n Mago: Nivel 32"
es_636,"Este amuleto tranquiliza tu mente."
es_637,"Aunque el arco es pequeño, no se debería subestimar su poder de ataque."
es_638,"Este libro de hechizos raro proviene de las bendiciones de Teon y contiene conjuros mágicos avanzados. \n Categoría: Habilidad de nivel 4 (clase) \n Efecto: Tiene la probabilidad de E333paralizar a todos los enemigos de la pantalla. \n Requisito de aprendizaje: \n Mago: Nivel 40"
es_639,"Cuero de alta calidad refinado."
es_640,"¡El misterioso cristal grabado con escrituras antiguas de elfos contiene sorprendentes poderes mágicos! \n Categoría: Habilidad de nivel 3 (clase) \n Efecto: Probabilidad de liberar monstruos que han sido invocados. \n Requisito de aprendizaje: \n Mago: Nivel 30"
es_641,"Los afilados cuchillos a ambos lados de la alabarda y las espinas de su cuerpo hacen que sea muy difícil que nadie lo pueda esquivar."
es_642,"Un fragmento de platino tosco."
es_643,"Estas escrituras de mago antiguas contienen el conocimiento de poderes mágicos. \n Categoría: Habilidad de nivel 2 (clase) \n Efecto: Activa un terremoto cerca del lanzador del hechizo que inflige daño a los enemigos dentro de una unidad de distancia a partir del lanzador. \n Requisito de aprendizaje: \n Mago: Nivel 32"
es_644,"Existen registros de extraños encantamientos y símbolos."
es_645,"Una armadura común empleada por soldados."
es_646,"Esta placa es fuerte y duradera."
es_647,"El libro de hechizos de Edin contiene habilidades mágicas elementales. \n Categoría: Habilidad de nivel 1 (común) \n Efecto: Te teletransporta a un lugar aleatorio o a un lugar determinado si se usa con el anillo del teletransporte. \n Requisito de aprendizaje: \n Real: Nivel 10 \n Mago: Nivel 4 \n Elfo: Nivel 8 \n Caballero: Nivel 50"
es_648,"Una espada excelente que puede matar a demonios y monstruos."
es_649,"Los cristales de viento provienen de la bendición de la Diosa de la Luna, que contiene atributos de viento. \n Categoría: Habilidad de nivel 3 (clase) \n Efecto: Aumenta la frecuencia de impacto del a larga distancia del objetivo en 6 puntos. \n Requisito de aprendizaje: \n Elfo: Nivel 30"
es_650,"El libro de hechizos de Edin contiene habilidades mágicas elementales. \n Categoría: Habilidad de nivel 1 (común) \n Efecto: Usa la magia para invocar una fuente de luz que ilumina una área alrededor del lanzador del hechizo durante 3600 segundos. \n Requisito de aprendizaje: \n Real: Nivel 10 \n Mago: Nivel 4 \n Elfo: Nivel 8 \n Caballero: Nivel 10"
es_651,"Su forma es como dos hojas verdes superpuestas con hermosos detalles de agua corriente."
es_652,"La forma en que el anciano oscuro practica su magia es extraña, y siempre busca la esencia de la magia viajando a cualquier parte adonde es atraído. Aumenta tu recuperación de PM."
es_653,"Este libro de hechizos raro proviene de las bendiciones de Teon y contiene conjuros mágicos avanzados. \n Categoría: Habilidad de nivel 4 (clase) \n Efecto: Crea un escudo protector invencible. Resistirá todos los ataques durante 12 segundos. El hechizo finaliza cuando lanzas otro hechizo. \n Requisito de aprendizaje: \n Mago: Nivel 40"
es_654,"Se puede usar para crear armas poderosas que infligen daño adicional a los no muertos. "
es_655,"El amuleto de cristal púrpura es profundo e inteligente."
es_656,"Este fino fragmento de placa de armadura es brillante y reluciente."
es_657,"Este valioso libro de hechizos contiene conjuros avanzados que otorgan el poder de dioses y demonios. \n Categoría: Habilidad de nivel 6 (común) \n Efecto: Bendice armas para aumentar su valor de ataque y su frecuencia de impacto. \n Requisito de aprendizaje: \n Mago: Nivel 24 \n Elfo: Nivel 48"
es_658,"Este valioso libro de hechizos contiene conjuros avanzados que otorgan el poder de dioses y demonios. \nCategoría: Habilidad de nivel 6 (común) \nEfecto: El hechizo aumenta la velocidad del objetivo un 50% durante 20 minutos. No se puede volver a lanzar mientras esté activo sobre el objetivo. \nRequisito de aprendizaje: \nMago: Nivel 24 \nElfo: Nivel 48"
es_659,"Estas escrituras de mago antiguas contienen el conocimiento de poderes mágicos. \n Categoría: Habilidad de nivel 1 (clase) \n Efecto: \n Requisito de aprendizaje: \n Mago: Nivel 28"
es_660,"El estoque tiene una hoja afilada que puede infligir daño adicional a los no muertos."
es_661,"El pergamino está grabado con runas mágicas de teletransporte. Con él puedes trasladarte a la ciudad más cercana."
es_662,"El ojo de Scatha es un material raro de alta calidad."
es_663,"Los cristales de agua provienen de las bendiciones de la Diosa de la Luna. Contienen atributos de poder de agua.  \n Categoría: Habilidad de nivel 5 (clase) \n Efecto: Resucita a los muertos y recupera por completo su fortaleza física. \n Requisito de aprendizaje: \n Elfo: Nivel 50"
es_664,"Una extraña maza de hierro con símbolos desconocidos."
es_665,"El código de caballería de los caballeros comprende habilidades de combate, cómo deben actuar y su auténtica fuente de poder. \n Categoría: Habilidad de nivel 2 (clase) \n Efecto: La armadura desarrolla púas mágicas que pueden infligir daño a las armas de los enemigos. \n Requisito de aprendizaje: \n Caballero: Nivel 60"
es_666,"Resistente y duradero."
es_667,"Este libro de hechizos de Edin contiene habilidades mágicas elementales. \n Categoría: Habilidad de nivel 2 (común) \n Efecto: Aumenta la capacidad de carga personal durante un periodo de tiempo, lo que permite transportar más objetos. \n Requisito de aprendizaje: \n Real: Nivel 20 \n Mago: Nivel 8 \n Elfo: Nivel 16"
es_668,"Este libro de hechizos raro de Edin contiene habilidades mágicas intermedias. \n Categoría: Habilidad de nivel 3 (común) \n Efecto: Descubre mágicamente los miedos más íntimos de tus enemigos y los refleja en ti para que te teman+E355. \n Requisito de aprendizaje: \n Mago: Nivel 12 \n Elfo: Nivel 24"
es_669,"La hoja está fabricada por los elfos e inflige daño adicional a los no muertos."
es_670,"Este libro de hechizos raro proviene de las bendiciones de Teon y contiene conjuros mágicos avanzados. \n Categoría: Habilidad de nivel 3 (clase) \n Efecto: \n Requisito de aprendizaje: \n Mago: Un mago de nivel 36A vertió una poción mágica sobre esta túnica, haciendo que se volviera más fuerte y olorosa."
es_671,"Un mago vertió una poción mágica sobre esta túnica, haciendo que se volviera más fuerte y olorosa.\n Efecto(s) de conjunto: PM +50"
es_672,"Una fruta deliciosa roja brillante."
es_673,"Yelmo de cuero élfico suave."
es_674,"Chaqueta de madera resistente."
es_675,"¡Un misterioso cristal grabado con escrituras antiguas de elfos que contiene sorprendentes poderes mágicos! \n Categoría: Habilidad de nivel 3 (clase) \n Efecto: Convierte 34 PS en 12 PM. \n Requisito de aprendizaje: \n Elfo: Nivel 30"
es_676,"Un hacha de batalla gigante y pesada forjada con acero refinado."
es_677,"El libro de hechizos de Edin contiene habilidades mágicas intermedias. \n Categoría: Habilidad de nivel 3 (común) \n Efecto: Probabilidad de debilitar a los no muertos para E364matarlos con facilidad o un 5%% de probabilidades de encolerizarlos. \n Requisito de aprendizaje: \n Mago: Nivel 12 \n Elfo: Nivel 24 "
es_678,"Bafomet quería convertirse en un guerrero de brillante armadura antes de transformarse en demonio. Efecto: oportunidad de ser inmune a parálisis cuando lo equipas."
es_679,"Este libro de hechizos raro proviene de las bendiciones de Teon y contiene conjuros mágicos avanzados. \n Categoría: Habilidad de nivel 4 (clase) \n Efecto: Invoca meteoros para aplastar a tus enemigos infligiéndoles un gran daño dentro de una unidad de distancia del objetivo. \n Requisito de aprendizaje: \n Mago: Nivel 40"
es_680,"La poción mágica azul se puede usar para recuperar veneno."
es_681,"La poción mágica intensa se puede usar para recuperar PS. "
es_682,"Esta elegante armadura de seda dorada fue la codicia inagotable de Bran.\n Efecto(s) de conjunto: Transforma en Bran. PR -4, recuperación de PS -7"
es_683,"Este valioso libro de hechizos contiene conjuros avanzados que otorgan el poder de dioses y demonios. \n Categoría: Habilidad de nivel 5 (común) \n Efecto: Recupera una gran cantidad de fuerza física y causa daño a los no muertos. \n Requisito de aprendizaje: \n Mago: Nivel 20 \n Elfo: Nivel 40"
es_684,"Un fino y largo hilo textil."
es_685,"Un escudo de cuero grueso.\n Efecto(s) de conjunto: PR -3"
