tw_979,"皇室秘典，承載著古往今來的王者之能！ \n分類：2級魔法（職業）\n效果：能傳送到同公會的指定成員身邊。 \n學習要求：\n王族：45級"
tw_980,"珍貴的魔法書籍，蘊含著強大的神魔之力，記錄著高級魔法技能。 \n分類：5級魔法（通用）\n效果：施放由寒冰之氣形成的尖錐，使目標受到傷害。 \n學習要求：\n法師：20級\n精靈：40級"
tw_981,"鐵製盾牌，盾上刻有古老符文，似乎是某個獸人部族的標誌。\n激活套裝後：防禦-3"
tw_982,柔軟的皮製夾克。
tw_983,"伊丁大陸上公開的魔法書籍，記錄著初級魔法技能。 \n分類：2級魔法（通用）\n效果：賦予武器魔法力量，增加目標武器的2點傷害值。 \n學習要求：\n王族：20級\n法師：8級\n精靈：16級"
tw_984,閃著銀色光芒的珍貴鑰匙。
tw_985,"柔軟的皮背心。\n激活套裝後：防禦-3"
tw_986,"柔軟的皮製圓帽。\n激活套裝後：防禦-3"
tw_987,使用後，永久增加力量。
tw_988,"珍稀的魔法手札，遠古魔法師的畢生之著，記載著遠古魔法師對法則的感悟與心得。 \n分類：1級魔法（職業）\n效果：召喚出能幫助施法者的怪物，怪物的數量依施法者魅力而定，而施法者的等級亦會影響召喚的怪物種類。 \n學習要求：\n法師：28級"
tw_989,"伊丁大陸上較為少見的魔法書籍，記錄著中級魔法技能\n分類：4級魔法（通用）\n效果：利用土之力量形成巨大荊棘，在敵人腳底刺出並纏繞目標，使目標及其周圍1個單位內的敵人受傷。 \n學習要求：\n法師：16級\n精靈：32級"
tw_990,柔軟的皮製頭盔。
tw_991,碧綠翡翠玉項鍊，裝備後增加敏捷屬性。
tw_992,"火晶石，源自月光女神的祝福，蘊含著躁動的火屬性力量！ \n分類：5級魔法（職業）\n效果：在持續時間內，使施法者近戰武器攻擊力最大化。 \n學習要求：\n精靈：50級"
tw_993,黑騎士軍團的專用佩劍，黑騎士軍團是阿提拉暴政的執行者！
tw_994,"珍貴的魔法書籍，蘊含著強大的神魔之力，記錄著高級魔法技能。 \n分類：6級魔法（通用）\n效果：釋放詛咒，有一定機率使目標降低近身物理攻擊傷害及命中率。 \n學習要求：\n法師：24級\n精靈：48級"
tw_995,不知道什麼蛋，反正不是壞蛋。
tw_996,採用奧里哈魯根鍛造而成，永不磨損，對不死系傷害加成。
tw_997,閃爍著光芒的血之腰帶，裝備後體力恢復增強。
tw_998,特殊的魔法戒指，嵌合風靈之痕，裝備後提升風屬性防禦。
tw_999,"珍稀的魔法典籍，源自創世神蒂安的祝福，蘊含高等法則之力。 \n分類：3級魔法（職業）\n效果：使目標及其周圍1個單位內的所有敵人都有一定機率沉睡，持續32秒，一旦受到攻擊則會立即甦醒。 \n學習要求：\n法師：36級"
tw_1000,赤若紅炎的卓越紅寶石。
tw_1001,水龍的鱗片，散發著柔和的水之力。
tw_1002,"伊丁大陸上較為少見的魔法書籍，記錄著中級魔法技能\n分類：4級魔法（通用）\n效果：用魔法纏繞對方武器，有一定的機率損壞目標的武器。 \n學習要求：\n法師：16級\n精靈：32級"
tw_1003,黑布斗篷外嵌銀片，每一塊銀片都刻有魔法符文，組成堅固的魔法防禦罩，裝備後魔力恢復增強。
tw_1004,特殊的魔法戒指，嵌合大地之石，裝備後提升地屬性防禦。
tw_1005,"這種布料似乎能吸收魔法傷害，做成斗篷肯定是極好！ \n——巴拉爾日記。"
tw_1006,清澈的水中蘊含著一股神秘力量。
tw_1007,"珍稀的魔法典籍，源自創世神蒂安的祝福，蘊含高等法則之力。 \n分類：3級魔法（職業）\n效果：凍結目標身上的藥水道具，有一定機率使目標在持續時間內無法使用任何藥水。 \n學習要求：\n法師：36級"
tw_1008,經過專業加工的銀金屬板。
tw_1009,"火晶石，源自月光女神的祝福，蘊含著躁動的火屬性力量！ \n分類：5級魔法（職業）\n效果：使施放者在超負重狀態下仍可回復體力值和魔法值。 \n學習要求：\n精靈：50級"
tw_1010,"珍稀的魔法手札，遠古魔法師的畢生之著，記載著遠古魔法師對法則的感悟與心得。 \n分類：1級魔法（職業）\n效果：使施法者的速度提高50%，持續時間30分鐘，效果不能疊加。 \n學習要求：\n法師：28級"
tw_1011,做工精細的秘銀絲線。
tw_1012,舒適的短靴。
tw_1013,"火晶石，源自月光女神的祝福，蘊含著躁動的火屬性力量！ \n分類：5級魔法（職業）\n效果：使施法者提升6點近戰物理傷害。 \n學習要求：\n精靈：50級"
tw_1014,風龍的鱗片，散發著飄渺的風之力。
tw_1015,"水晶石，源自月光女神的祝福，蘊含著祥和的水屬性力量！ \n分類：4級魔法（職業）\n效果：使目標提升體力回复速度，等級越高回復量越多，最多增加15。 \n學習要求：\n精靈：40級"
tw_1016,"伊丁大陸上較為少見的魔法書籍，記錄著中級魔法技能\n分類：3級魔法（通用）\n效果：利用魔法遮蔽敵人視線，有一定機率使目標在持續時間內致盲。 \n學習要求：\n法師：12級\n精靈：24級"
tw_1017,"珍稀的魔法手札，遠古魔法師的畢生之著，記載著遠古魔法師對法則的感悟與心得。 \n分類：1級魔法（職業）\n效果：使敵人疾病纏身，有一定機率減弱目標12點防禦力及降低6點命中率。 \n學習要求：\n法師：28級"
tw_1018,鎧甲採用開式鱗片相間而成，堅固厚重。
tw_1019,斯科特的大肉，珍稀的高等材料。
tw_1020,骷髏心骨絞合而成的項鍊。
tw_1021,鉤戟兩端尖刺，倒鉤制敵。
tw_1022,蟻后裡層的風翼，閃耀著黃金光芒，擁有較大的魔法防禦。
tw_1023,"火晶石，源自月光女神的祝福，蘊含著躁動的火屬性力量！ \n分類：4級魔法（職業）\n效果：為自己及同隊伍成員增加4點物理攻擊力。 \n學習要求：\n精靈：40級"
tw_1024,錘膽形如刺球，緊鎖錘身，一錘定勝負。
tw_1025,錚亮的鐵板護甲。
tw_1026,深海黑珍珠，裝備後強健體魄。
tw_1027,精靈鐵匠大師的十三件傑作之一，採用耐磨損的奧里哈魯根鍛造而成，也是鐵匠大師的成名之作。
tw_1028,韌性十足的樹皮。
tw_1029,金閃閃的貨幣。
tw_1030,柔軟的皮製護甲。
tw_1031,採用秘銀製作而成的箭矢，傷害驚人。
tw_1032,"騎士典籍，記錄著騎士的格鬥技巧，闡述著騎士的力量之源。 \n分類：1級魔法（職業）\n效果：有一定機率使被攻擊者眩暈數秒，必須裝備雙手劍才能施放。 \n學習要求：\n騎士：50級"
tw_1033,"騎士典籍，記錄著騎士的格鬥技巧，闡述著騎士的力量之源。 \n分類：1級魔法（職業）\n效果：加強防禦，減少自身所受到的傷害，等級越高減免的傷害越多。 \n學習要求：\n騎士：50級"
tw_1034,蝎子成長時蛻下的皮殼。
tw_1035,這麼寬大的腰帶，足以看出食人魔的體型有多大！
tw_1036,硬實的鐵製盔甲。
tw_1037,"弱化狼人受邪惡氣息影響而長出恐怖的血腥獠牙。 \n任務道具"
tw_1038,"縱然時光流逝，依舊晶石永恆！此晶石是維持[歷時盤]運轉的能量之源。 \n任務道具"
tw_1039,"縱然時光流逝，依舊晶石永恆！此晶石是維持[歷時盤]運轉的能量之源，已被分解成碎片。 \n任務道具"
tw_1040,"神奇的藥水，蘊含淡淡香味，有舒心寧神的效果。 \n任務道具"
tw_1041,"弱化哈爾皮埃的羽毛，藏有弱化哈爾皮埃的飛行能力。 \n任務道具"
tw_1042,"弱化梟熊最喜歡的肉類，鮮嫩無比，彈性十足。 \n任務道具"
tw_1043,"精心烘烤的香草餅乾，看上去十分可口。 \n任務道具"
tw_1044,"地底深處的火屬性植物根莖，具有療傷效果，非常珍貴。 \n任務道具"
tw_1045,"利婭託人製作的治療藥水，具有治療效果。 \n任務道具"
tw_1046,"賈絲汀娜存放在倉庫的貨物，後來被莫名盜走。 \n任務道具"
tw_1047,"利婭丟失的貨箱，內裝有多件皮甲防具。 \n任務道具"
tw_1048,"殘破的斷刃，可用來製作強力武器。 \n任務道具"
tw_1049,"生靈死後，靈魂自動會脫離肉體。但部分潰散的靈魂會滯留在生靈體內，化成晶石。 \n任務道具"
tw_1050,"柔軟的人狼皮毛，韌性十足。 \n任務道具"
tw_1051,"食屍鬼體內的精血，是受詛咒的血液精華。 \n任務道具"
tw_1052,"亨特狩獵時收穫的皮革，可製作成為精良的防具。 \n任務道具"
tw_1053,零散的骨頭碎片。
tw_1054,獅鷲的輕質羽毛。
tw_1055,受精靈祝福，精煉而成的粉末。
tw_1056,煉金術師提煉的神秘溶液，可溶解特定物品。
tw_1057,"伊丁大陸上罕見的無名徽章，據說收集一定數量後，可跟德拉斯兌換專屬裝備。\n特殊物品"
tw_1058,"尖刺製造而成的皮涼鞋。\n激活套裝後：防禦-3"
tw_1059,"澤斯收藏多年的珍貴金屬，是打造裝備的上等材料。\n任務道具"
tw_1060,"來自虛空的隕鐵，在伊丁大陸上十分罕見。\n任務道具"
tw_1061,"詭異的骨頭，蘊含著亡靈的恐怖力量。\n任務道具"
tw_1062,"沾有血蹟的破碎皮革，寫著疑似坐標軸的奇怪數字。\n(X:32758)\n任務道具"
tw_1063,"沾有血蹟的破碎皮革，寫著疑似坐標軸的奇怪數字。\n(Y:32745)\n任務道具"
tw_1064,"散發著死亡氣息的骨髓。\n任務道具"
tw_1065,"神聖的力量解除邪惡束縛，枉死的靈魂得以救贖。\n任務道具"
tw_1066,"顫動的肉石之心。\n任務道具"
tw_1067,"邪惡的力量拘禁了靈魂，亡靈墜入黑暗深淵，等待正義的救贖。\n任務道具"
tw_1068,"奈特的地圖,記錄著應許之地建一層通往二層的入口。\n坐標(32678,32726)\n任務道具"
tw_1069," 一份記有古老隧道信息的手稿。\n任務道具"
tw_1070,"神秘的力量精華，蘊含的能量十分強大。\n任務道具"
tw_1071,"受到邪惡氣息侵染的靈魂晶石。\n任務道具"
tw_1072,"死亡騎士賦予骷髏軍團的力量之源。\n任務道具"
tw_1073,"來自遙遠星際的隕石。\n任務道具"
tw_1074,"螳螂人的心臟，已被邪惡侵蝕。\n任務道具"
tw_1075,"尖銳巨牙，取自人狼。\n任務道具"
tw_1076,"屍體腐爛後的液體。\n任務道具"
tw_1077,"不腐不壞的堅硬肉塊。\n任務道具"
tw_1078,"封裝好的貨物箱子。\n任務道具"
tw_1079,"裝有大量糧食的包裹。\n任務道具"
tw_1080,詭異的魔法石盒。
tw_1081,伊丁世界與創世神Teon簽訂的誓約之書。
tw_1082,亙古時代的珍貴鉑金幣，經歷滄桑歲月，依然光澤明亮，可與神秘商人購買物資。
