es_686,"Estas escrituras de mago antiguas contienen el conocimiento de poderes mágicos. \n Categoría: Habilidad de nivel 1 (clase) \n Efecto: Invoca un poderoso torbellino que inflige daño a los enemigos dentro de dos unidades de distancia a partir del lanzador del hechizo. \n Requisito de aprendizaje: \n Mago: Nivel 28"
es_687,"Una de las 13 obras maestras del maestro herrero elfo. Durante su fabricación, los orcos realizaron una invasión. Cuando eso sucedió, la hoja se pudo finalizar y se convirtió en un arma más poderosa que infligiría daño adicional a los no muertos. "
es_688,"Un rubí ordinario. "
es_689,"Armadura del caballero valiente - Guantelete de hierro.\n Efecto(s) de conjunto: PR -3 "
es_690,"Una tela de alta calidad, roja como el fuego. "
es_691,"Un garrote de madera gigante con pinchos,+E381 muy peligroso."
es_692,"Un arco de madera sólido, el favorito de los orcos."
es_693,"Los cristales de tierra provienen de la bendición de la Diosa de la Luna y contienen poderosos atributos de tierra. \n Categoría: Habilidad de nivel 5 (clase) \n Efecto: Aumenta la defensa en 10 puntos durante un periodo de tiempo. \n Requisito de aprendizaje: \n Elfo: Nivel 50"
es_694,"Una fruta amarga amarilla."
es_695,"El libro de hechizos de Edin contiene habilidades mágicas elementales. \n Categoría: Habilidad de nivel 2 (común) \n Efecto: Absorbe algunos PS del objetivo y los añade a los tuyos. \n Requisito de aprendizaje: \n Real: Nivel 20 \n Mago: Nivel 8 \n Elfo: Nivel 16"
es_696,"Daño mágico +1\nUn bastón refinado fabricado con roble de gran calidad."
es_697,"Un escudo alto poderoso."
es_698,"Este libro de magia raro proviene de las bendiciones de Teon y contiene poderosas habilidades mágicas. \n Categoría: Habilidad de nivel 4 (clase) \n Efecto: Intercambia las posiciones entre el lanzador del hechizo y el objetivo. \n Requisito de aprendizaje: \n Mago: Nivel 40"
es_699,"Un arma de novicio poderosa. "
es_700,"Este libro de magia raro proviene de las bendiciones de Teon y contiene poderosas habilidades mágicas. \n Categoría: Habilidad de nivel 3 (clase) \n Efecto: Lanzar un tornado llameante inflige daño a todos los enemigos que rodean al lanzador, Inflige daño a todos los objetivos (excepto a los jugadores con nombre blanco y nombre azul) alrededor del lanzador. \n Requisito de aprendizaje: \n Mago: Nivel 36"
es_701,"Un casco de hierro con hechizos de protección inscritos que puede absorber el daño mágico. Por cada nivel de mejora, aumenta la resistencia a la magia +1."
es_702,"Los cristales de tierra provienen de la bendición de la Diosa de la Luna y contienen poderosos atributos de tierra. \n Categoría: Habilidad de nivel 4 (clase) \n Efecto: Aumenta la PR en 7 puntos para ti y tu equipo. \n Requisito de aprendizaje: \n Elfo: Nivel 40"
es_703,"Un montón de hierro"
es_704,"Estos valiosos libros mágicos contienen el gran poder de dioses y demonios y registros de habilidades mágicas avanzadas. \n Categoría: Habilidad de nivel 5 (común) \n Efecto: Invoca la sombra oscura para obtener la probabilidad de cegar a los enemigos durante 32 segundos. \n Requisito de aprendizaje: \n Mago: Nivel 20 \n Elfo: Nivel 40"
es_705,"Este misterioso pergamino, presuntamente originario de Teon, otorga una protección temporal al equipo, lo que garantiza que solo desaparece el nivel de encantamiento y el equipo no se ve afectado cuando el proceso de encantamiento falla."
es_706,"Un arco largo mejorado."
es_707,"Los cristales de tierra provienen de la bendición de la Diosa de la Luna y contienen poderosos atributos de tierra. \n Categoría: Habilidad de nivel 5 (clase) \n Efecto: Permite al lanzador del hechizo recuperar PS y poder mágico aunque esté sobrecargado de objetos. \n Requisito de aprendizaje: \n Elfo: Nivel 50"
es_708,"Una esmeralda perfecta."
es_709,"Un misterioso tomo sagrado escrito en una lengua antigua."
es_710,"Bran detestaba portar esta capucha pues consideraba que impediría su visión.\n Efecto(s) de conjunto: Transforma en Bran. PR -4, recuperación de PS -7"
es_711,"Los caballeros oscuros son los ejecutores de la tiranía del Rey Atila. Esta arma está creada especialmente para ellos."
es_712,"Una casaca de cuero con pinchos inclinados sobre los hombros para impedir que los enemigos se acerquen. \n Efecto(s) de conjunto: PR -3"
es_713,"Un registro de mago raro que detalla sus experiencias y su conocimiento de la magia.  \nCategoría: Habilidad de nivel 1 (clase)\nEfecto: Cura a todos los miembros del gremio en la pantalla.\nRequisito de aprendizaje:\nMago: Nivel 28"
es_714,"En lo que se refiere a un material tan raro como el oricalco, incluso el maestro herrero elfo necesita tiempo para trabajar con él. Puedes fabricar armas poderosas que infligen daño adicional a los no muertos."
es_715,"Una gran hacha fantástica para abrirte paso a través de tus enemigos. "
es_716,"Un escudo protector pequeño. "
es_717,"Este valioso libro de hechizos contiene conjuros avanzados que otorgan el poder de dioses y demonios. \n Categoría: Habilidad de nivel 5 (común) \n Efecto: Invoca relámpagos para atacar a tus enemigos. \n Requisito de aprendizaje: \n Mago: Nivel 20 \n Elfo: Nivel 40"
es_718,"Este yelmo del viento es inestable, pero puede acelerar la velocidad de lanzamiento de hechizos."
es_719,"Una capucha confortable que ayuda a ocultar el rostro de un hechicero.\n Efecto(s) de conjunto: PM +50"
es_720,"Este amuleto tiene daños y es inestable."
es_721,"Rubí de alta calidad."
es_722,"Se dice que esta espada proviene de un país muy lejano. Inflige gran daño tus enemigos."
es_723,"Un montón de un metal raro."
es_724,"La capa de la tierra mágica está decorada con motivos de bosques frondosos de la tierra. Fortalece la recuperación mágica y aumenta la defensa contra ataques que tengan atributos de tierra."
es_725,"Tras la transformación de Galahad a la oscuridad, sus manos ensangrentadas formaron estos guanteletes hechizados. \n Efecto(s) de conjunto: Transforma en un caballero de la muerte. PR -4, recuperación de PS -7"
es_726,"¡El misterioso cristal grabado con escrituras antiguas de elfos contiene sorprendentes poderes mágicos! \n Categoría: Habilidad de nivel 5 (clase) \n Efecto: Probabilidad de reflejar ataques mágicos durante un periodo de tiempo. \n Requisito de aprendizaje: \n Elfo: Nivel 50 "
es_727,"Un par de cómodas sandalias de cuero de novicio."
es_728,"Cuando el habilidoso artesano descubrió que el arco y la flecha tradicionales no podían perforar la gruesa piel de orco, fabricó esta ballesta compuesta con gran fuerza de perforación creada con materiales muy diversos."
es_729,"La lanza de orco que usan los guardias orcos."
es_730,"La poción de magia púrpura hace que aceleres tu velocidad hasta dos veces. Solo funciona con caballeros、Real. "
es_731,"La escama de dragón de fuego contiene el poder del fuego."
es_732,"Los cristales de fuego provienen de la bendición de la Diosa de la Luna, que contiene atributos de fuego. \n Categoría: Habilidad de nivel 5 (clase) \n Efecto: 33% de probabilidad de aumentar el daño de ataque físico 1,5 veces. \n Requisito de aprendizaje: \n Elfo: Nivel 50"
es_733,"Armadura del caballero valiente - Placa de malla de hierro.\n Efecto(s) de conjunto: PR -3"
es_734,"Este pergamino puede mostrar los atributos de un objeto. "
es_735,"El libro de hechizos de Edin contiene habilidades mágicas elementales. \n Categoría: Habilidad de nivel 2 (común) \n Efecto: Revela monstruos y jugadores ocultos y los hace visibles. \n Requisito de aprendizaje: \n Real: Nivel 20 \n Mago: Nivel 8 \n Elfo: Nivel 16 "
es_736,"Este amuleto está dilapidado y es inestable."
es_737,"¡Bravura y lealtad al Rey!\n- Juramento del Caballero Rojo.\n Efecto(s) de conjunto: PR -2, RM +10"
es_738,"La placa de oro fue fabricada por un maestro."
es_739,"¡El misterioso cristal grabado con escrituras antiguas de elfos contiene un sorprendente poder mágico! \n Categoría: Habilidad de nivel 3 (clase) \n Efecto: Lanza tres flechas a la vez e inflige daño a los enemigos tras de sí. Solo funciona con un arco. \n Requisito de aprendizaje: \n Elfo: Nivel 30"
es_740,"La protección preferida de los elfos. "
es_741,"Estos libros de hechizos raros provienen de las bendiciones de Teon y contienen enseñanzas mágicas avanzadas. \n Categoría: Habilidad de nivel 4 (clase) \n Efecto: Teletransporta al lanzador del hechizo y a los objetivos en 4 unidades de distancia desde el lanzador del hechizo a posiciones aleatoria+E431s. El lanzador también puede usar el anillo de teletransporte para moverse a una ubicación determinada. \n Requisito de aprendizaje: \n Mago: Nivel 40"
es_742,"Armadura fabricada con los huesos de guerreros muertos. \n Efecto(s) de conjunto: PR -2, PS +10"
es_743,"Esta capa mágica fortalece la recuperación de PM y aumenta la resistencia al fuego."
es_744,"La hoja tiene forma de luna creciente. "
es_745,"Este libro de hechizos raro de Edin contiene habilidades mágicas intermedias. \nCategoría: Habilidad de nivel 4 (común) \nEfecto: Lanza un escudo mágico protector que puede resistir un ataque mágico durante 16 segundos. \nRequisito de aprendizaje: \nMago: Nivel 16 \nElfo: Nivel 32"
es_746,"Los cristales de agua provienen de la bendición de la Diosa de la Luna y contienen atributos de agua. \nCategoría: Habilidad de nivel 3 (clase) \nEfecto: Duplica el efecto del primer hechizo de curación mágica del objetivo durante un periodo de tiempo. \nRequisito de aprendizaje: \nElfo: Nivel 30"
es_747,"Una elegante capa roja."
es_748,"Un cinturón grabado con extrañas runas mágicas. "
es_749,"Parece el cuchillo de madera que se usa en rituales."
es_750,"Una excelente tela blanca y pura."
es_751,"Aumenta tu nivel de inteligencia permanentemente tras su uso."
es_752,"Este libro de hechizos raro de Edin contiene habilidades mágicas intermedias. \n Categoría: Habilidad de nivel 4 (común) \n Efecto: Absorbe los PS del objetivo y los añade a los tuyos. \n Requisito de aprendizaje: \n Mago: Nivel 16 \n Elfo: Nivel 32"
es_753,"Mata a todos los enemigos con su arma de largo alcance. "
es_754,"Casaca de cuero suave con cinturón "
es_755,"El pergamino está grabado con runas mágicas que pueden trasladarte aleatoriamente a otras ciudades."
es_756,"Armadura gruesa y resistente."
es_757,"Los cristales de agua provienen de la bendición de la Diosa de la Luna y contienen atributos de agua. \n Categoría: Habilidad de nivel 4 (clase) \n Efecto: Protege el objetivo con magia de agua y aumenta cinco puntos de RE. \n Requisito de aprendizaje: \n Elfo: Nivel 40"
es_758,"Botas altas suaves y marrones."
es_759,"Estos libros de hechizos raros provienen de las bendiciones de Teon y contienen enseñanzas mágicas avanzadas. \n Categoría: Habilidad de nivel 3 (clase) \n Efecto: Cambia la forma de tu oponente durante un periodo de tiempo. \n Requisito de aprendizaje: \n Mago: Nivel 36"
es_760,"Todos aquellos que presenciaron la crueldad de Bran están muertos.\n Efecto(s) de conjunto: Transforma en Bran. PR -4, recuperación de PS -7"
es_761,"Gemas mágicas de colores."
es_762,"Este yelmo mágico te permite acelerar tu velocidad de lanzamiento de hechizos."
es_763,"Estas escrituras de mago antiguas contienen el conocimiento de poderes mágicos. \nCategoría: Habilidad de nivel 1 (clase) \nEfecto: Aumenta 5 puntos tu daño físico y el de tu equipo. Disminuye 10 de PR y contrarresta el hechizo de recuperación. \nRequisito de aprendizaje: \nMago: Nivel 28"
es_764,"El tomo secreto real contiene el conocimiento de todos los reyes desde el origen de los tiempos. \nCategoría: Habilidad de nivel 2 (clase) \nEfecto: Fortalece tu defensa mágica y tu frecuencia de impacto y las de los miembros del equipo. \nRequisito de aprendizaje: \nReal: Nivel 40"
es_765,"El tomo secreto contiene el conocimiento de todos los reyes desde el origen de los tiempos. \n Categoría: Habilidad de nivel 2 (clase) \n Efecto: Aumenta 8 puntos tu defensa y la de los miembros de tu equipo. \n Requisito de aprendizaje: \n Real: Nivel 55"
es_766,"Un montón de hierro"
es_767,"La suave capucha de Skuld fortalece la recuperación de PM."
es_768,"Un sangriento corazón de draco."
es_769,"Una flecha ordinaria."
es_770,"Una fruta fresca y deliciosa (sí, el tomate es en realidad una fruta).E462"
es_771,"Este misterioso pergamino puede purgar equipo maldito."
es_772,"Los cristales de tierra provienen de la bendición de la Diosa de la Luna y contienen poderosos atributos de tierra. \nCategoría: Habilidad de nivel 3 (clase) \nEfecto: Probabilidad de reducir la velocidad de movimiento del objetivo un 25%. \nRequisito de aprendizaje: \nElfo: Nivel 30"
es_773,"La espada de un caballero rojo."
es_774,"Su poder es muy inestable, ya que ha sufrido daños."
es_775,"Un billete de ferry para uno."
es_776,"Botas de cuero suave."
es_777,"Estos libros de hechizos raros provienen de las bendiciones de Teon y contienen enseñanzas mágicas avanzadas. \n Categoría: Habilidad de nivel 3 (clase) \n Efecto: Invoca relámpagos y tormentas para atacar a tu enemigo dentro de una unidad de distancia del objetivo de lanzamiento. \n Requisito de aprendizaje: \n Mago: Nivel 36"
es_778,"Este pergamino fortalece y mejora la armadura."
es_779,"Un zafiro ordinario."
es_780,"El poder de este amuleto está dilapidado y es inestable."
es_781,"Los cristales de viento provienen de la bendición de la Diosa de la Luna, que contiene atributos de viento. \n Categoría: Habilidad de nivel 5 (clase) \n Efecto: Probabilidad de hacer que el objetivo pierda su habilidad de evasión de ataques lejanos durante un periodo de tiempo. \n Requisito de aprendizaje: \n Elfo: Nivel 50"
es_782,"Una flecha de plata refinada."
es_783,"El cinturón grabado con escrituras antiguas que le concede el poder de las almas. "
es_784,"Sandalias de cuero suave.\n Efecto(s) de conjunto: PR -3"
es_785,"Los cristales de viento provienen de la bendición de la Diosa de la Luna, que contiene atributos de viento. \n Categoría: Habilidad de nivel 5 (clase) \n Efecto: Se traslada al instante a un lugar específico donde no hay obstáculos. \n Requisito de aprendizaje: \n Elfo: Nivel 50"
es_786,"El libro de hechizos de Edin contiene habilidades mágicas elementales. \nCategoría: Habilidad de nivel 1 (común) \nEfecto: Forma un escudo protector y disminuye la PR en 2 puntos. No se puede volver a lanzar hasta que el hechizo haya finalizado. \nRequisito de aprendizaje: \nReal: Nivel 10 \nMago: Nivel 4 \nElfo: Nivel 8 \nCaballero: Nivel 30"
es_787,"Una placa de mithril."
es_788,"Una cómoda casaca de novicio."
es_789,"El misterioso pergamino fortalece el equipo con atributos de agua."
es_790,"La meticulosa artesanía de Nestor hizo que esta cimitarra fuera muy poderosa."
es_791,"Harina de trigo."
es_792,"Es una de las 13 obras maestras del maestro herrero elfo. Se dice que tardó 10 años en forjarla. Un dios que admiraba las extraordinarias habilidades de forja del maestro bendijo este arco en persona. No temas nunca quedarte sin flechas, ya que este arco te concede flechas mágicas para disparar. "
es_793,"Estos libros de hechizos raros provienen de las bendiciones de Teon y contienen enseñanzas mágicas avanzadas. \nCategoría: Habilidad de nivel 3 (clase) \nEfecto: Crea una enorme escudo protector mágico que reduce el daño recibido por tu objetivo a la mitad mientras está activo. \nRequisito de aprendizaje: \nMago: Nivel 36"
es_794,"Un casco común de caballero que se encuentra en Edin."
es_795,"Un tridente incomparable. Perfora en gran profundidad a los enemigos y los deja desangrándose. "
es_796,"Estos antiguos cereales pueden engañar a tu mente después de ingerirlos."
es_797,"Este valioso pergamino fortalece y mejora tus armas."
es_798,"El descenso de Galahad a la oscuridad también infectó su armadura y la llenó de maldad.\n Efecto(s) de conjunto: Transforma en un caballero de la muerte. PR -4, recuperación de PS -7"
es_799,"Escudo de caballero de plata que brilla con la luz del sol. "
es_800,"Capucha suave de Svipdag."
es_801,"Una placa de platino."
es_802,"Capucha suave de Sauroner."
es_803,"Esta espada corta de resistencia a la magia fue bendecida los elfos. Inflige daño adicional a los no muertos."
es_804,"Sangre fresca de ogro."
es_805,"La capa de piel de aceite está decorada con huesos de bestia alrededor del cuello.\n Efecto(s) de conjunto: PR -3"
es_806,"Este libro de hechizos raro de Edin contiene habilidades mágicas intermedias. \nCategoría: Habilidad de nivel 4 (común) \nEfecto: Invoca bolas de fuego resplandecientes para quemar a tus enemigos dentro de una unidad de distancia del lanzador objetivo. \nRequisito de aprendizaje: \nMago: Nivel 16 \nElfo: Nivel 32"
es_807,"Capucha suave de Endor."
es_808,"Una espada ordinaria a dos manos muy fácil de usar. "
es_809,"¡El misterioso cristal grabado con escrituras antiguas de elfos contiene un sorprendente poder mágico! \n Categoría: Habilidad de nivel 5 (clase) \n Efecto: Invoca un elfo poderoso con el mismo atributo que tú. \n Requisito de aprendizaje: \n Elfo: Nivel 50"
es_810,"El Rey Arturo ordenó a su pueblo fabricar el arma más poderosa del mundo con la esperanza de hacer frente a los mismísimos dioses pero, tras ser encerrado en la Torre de Babel por Teon, la Hoja del destino desapareció hasta ahora. "
es_811,"Una rama de árbol llena de vigor y poder vital. Puede eliminar los venenos y recuperar tus PS."
es_812,"Este yelmo te permite lanzar los siguientes hechizos: \nEncantamiento físico: DES\nApresuramiento."
es_813,"Este valioso libro de hechizos contiene conjuros avanzados que otorgan el poder de dioses y demonios. \nCategoría: Habilidad de nivel 6 (común) \nEfecto: Probabilidad de dispersar la magia de los enemigos con el poder del viento. Puede eliminar todos los estados mágicos.\nRequisito de aprendizaje: \nMago: Nivel 24 \nElfo: Nivel 48"
es_814,"Una piedra fría y dura."
es_815,"El pergamino está grabado con runas mágicas que te teletransportan a una ciudad cercana."
es_816,"Una poción amarilla que aumenta tu concentración y PH."
es_817,"La bola de cristal mágico fue creada en el calor del océano."
es_818,"Un material raro de alta calidad."
es_819,"Estos guanteletes mágicos tienen atributos de viento que fortalecen la recuperación mágica y aumentan la defensa contra ataques de atributos de viento. "
es_820,"Los cristales de fuego provienen de la bendición de la Diosa de la Luna, que contiene atributos de fuego. \n Categoría: Habilidad de nivel 3 (clase) \n Efecto: Aumenta el valor de ataque físico del objetivo en 4 puntos. \n Requisito de aprendizaje: \n Elfo: Nivel 30"
es_821,"Este valioso libro de hechizos contiene conjuros avanzados que otorgan el poder de dioses y demonios. \n Categoría: Habilidad de nivel 5 (común) \n Efecto: Probabilidad de embrujar al objetivo y hacer que te siga. Cuanto menor sea la fuerza física del objetivo, mayor será la probabilidad de lanzar con éxito. \n Requisito de aprendizaje: \n Mago: Nivel 20 \n Elfo: Nivel 40"
es_822,"Este libro de hechizos raro proviene de las bendiciones de Teon y contiene conjuros mágicos avanzados. \n Categoría: Habilidad de nivel 4 (clase) \n Efecto: Invoca un torbellino de tormenta de nieve contra tus enemigos a una distancia de 5 unidades del lanzador del hechizo. Probabilidad de congelar a los oponentes. \n Requisito de aprendizaje: \n Mago: Nivel 40"
es_823,"Este valioso libro de hechizos contiene conjuros avanzados que otorgan el poder de dioses y demonios. \nCategoría: Habilidad de nivel 5 (común) \nEfecto: Probabilidad de absorber el valor mágico del objetivo y otorgarte un del mismo. \nRequisito de aprendizaje: \nMago: Nivel 20 \nElfo: Nivel 40"
es_824,"La malla de anillo de orco está pensada para poder ajustarse y así adaptarse a orcos de diferente tamaño.\n Efecto(s) de conjunto: PR -3"
es_825,"Una lanza resistente."
es_826,"Su largo alcance y hoja afilada la hacen letal. Provoca daño adicional a los no muertos."
es_827,"Estos guanteletes mejoran la resistencia al agua."
es_828,"Estos libros antiguos registraron diversos viajes mágicos en busca del conocimiento del poder supremo."
es_829,"Placa de mithril oscuro sólida. "
es_830,"Un par de guanteletes de novicio de cuero holgados. "
es_831,"Un anillo mágico especial combinado con el cristal llameante puede mejorar la resistencia al fuego."
es_832,"Esta espada es una de las obras más celebradas de Nestor."
es_833,"Una piedra de color turquesa. "
es_834,"Su filo afilado corta el aire con facilidad y provoca daño adicional a los no muertos."
es_835,"El libro de hechizos de Edin contiene habilidades mágicas elementales. \n Categoría: Habilidad de nivel 2 (común) \n Efecto: Lanza una flecha llameante mágica a un enemigo. \n Requisito de aprendizaje: \n Real: Nivel 20 \n Mago: Nivel 8 \n Elfo: Nivel 16"
es_836,"Este libro de hechizos raro de Edin contiene habilidades mágicas intermedias. \n Categoría: Habilidad de nivel 4 (común) \n Efecto: Lanza un hechizo de viento para cambiar las condiciones que rodean a los enemigos. Probabilidad de disminuir la velocidad de un objetivo. \n Requisito de aprendizaje: \n Mago: Nivel 16 \n Elfo: Nivel 32"
es_837,"Tras la muerte de Galahad, su alma fue tentada por el mal y cayó en la oscuridad, convirtiéndose en el caballero de la muerte. Su ira forjó una espada de fuego despiadada que tiene la probabilidad de activar habilidades mágicas."
es_838,"Hacha de acero de mango corto usada por cazadores en su labor. "
es_839,"El anillo de la invocación grabado con encantamientos misteriosos que puede invocar un tipo determinado de monstruo cuando se lleva puesto. "
es_840,"Se dice que la capa de invisibilidad fue tejida con seda de hielo mágico. Te hace invisible. Puedes desplazarte por ahí, pero no puedes hacer nada más mientras la llevas puesta."
es_841,"Este libro de hechizos raro de Edin contiene habilidades mágicas intermedias. \n Categoría: Habilidad de nivel 4 (común) \n Efecto: Lanza un hechizo de viento que aumenta la destreza del objetivo en 5 puntos. Los efectos del hechizo no se pueden multiplicar. \n Requisito de aprendizaje: \n Mago: Nivel 16 \n Elfo: Nivel 32"
es_842,"Nestro, el maestro herrero, ha reajustado sus habilidades de creación de armas. Le puso su propio nombre a su obra maestra."
es_843,"¡El misterioso cristal grabado con escrituras antiguas de elfos contiene un sorprendente poder mágico! \n Categoría: Habilidad de nivel 3 (clase) \n Efecto: Aumenta la defensa del lanzador de hechizos en un 50%%. \n Requisito de aprendizaje: \n Elfo: Nivel 30"
es_844,"Fragmentos de cristal de alma rotos."
es_845,"El libro de hechizos de Edin contiene habilidades mágicas elementales. \n Categoría: Habilidad de nivel 1 (común) \n Efecto: Aumenta el daño en general y causa daño adicional a los no muertos. \n Requisito de aprendizaje: \n Real: Nivel 10 \n Mago: Nivel 4 \n Elfo: Nivel 18 \n Caballero: Nivel 40"
es_846,"Una llave roja."
es_847,"Este libro de hechizos raro proviene de las bendiciones de Teon y contiene conjuros mágicos avanzados. \nCategoría: Habilidad de nivel 3 (clase) \nEfecto: Teletransporta al lanzador del hechizo y a los miembros del mismo gremio en 1 unidad de distancia desde el lanzador del hechizo a una posición aleatoria. También puedes usar el anillo de teletransporte para moverte a una ubicación determinada. \nRequisito de aprendizaje: \nMago: Nivel 36"
es_848,"Este libro de hechizos raro de Edin contiene habilidades mágicas intermedias. \n Categoría: Habilidad de nivel 4 (común) \n Efecto: Obtiene una velocidad de recuperación de PM más rápida de lo habitual. El hechizo finaliza cuando combates o te mueves. \n Requisito de aprendizaje: \n Mago: Nivel 16 \n Elfo: Nivel 32"
es_849,"El cristal puro y transparente incrustado en el bastón puede reconfortar el alma de un mago. La recuperación de PM se fortalece con este bastón."
es_850,"Guanteletes de cuero suave."
es_851,"Parece que esta tela puede absorber el daño mágico.\nPor cada nivel de mejora, aumenta la resistencia a la magia +2."
es_852,"Este libro de hechizos raro proviene de las bendiciones de Teon y contiene conjuros mágicos avanzados. \n Categoría: Habilidad de nivel 3 (clase) \n Efecto: Crea un campo de fuerza mágico que inflige daño a los enemigos dentro de una unidad de distancia a partir del lanzador. \n Requisito de aprendizaje: \n Mago: Nivel 36"
es_853,"Una espada ancha de hierro ordinaria."
es_854,"Estos guanteletes mágicos tienen atributos de fuego que fortalecen la recuperación mágica y aumentan la defensa contra ataques de atributos de fuego."
es_855,"Una corona de oro brillante."
es_856,"Este amuleto es muy valorado por orcos por su capacidad de aumentar los PS."
es_857,"Un yelmo fabricado con huesos.\n Efecto(s) de conjunto: PR -2, PS +10"
es_858,"El libro de hechizos de Edin contiene habilidades mágicas elementales. \n Categoría: Habilidad de nivel 2 (común) \n Efecto: Lanza un hechizo de tierra para hacer que crezcan estalagmitas bajo tus enemigos y así infligirles daño. \n Requisito de aprendizaje: \n Real: Nivel 20 \n Mago: Nivel 8 \n Elfo: Nivel 16"
es_859,"Aumenta tu nivel de carisma permanentemente."
es_860,"Una cómoda+E554 casaca."
es_861,"Una pluma completa."
es_862,"Fortalece la recuperación mágica."
es_863,"Un amuleto refinado fascinante."
es_864,"Esta armadura, grabada con runas de protección de la cruz sagrada, puede resistir el daño mágico.Por cada nivel de mejora, aumenta la resistencia a la magia +1."
es_865,"Aumenta tu nivel de sabiduría."
es_866,"Este valioso libro de hechizos contiene conjuros avanzados que otorgan el poder de dioses y demonios. \n Categoría: Habilidad de nivel 5 (común) \n Efecto: Dispersa maldiciones con la luz sagrada. Disipa las maldiciones del objetivo. \n Requisito de aprendizaje: \n Mago: Nivel 20 \n Elfo: Nivel 40  "
