cn_635,"珍稀的魔法手札，远古魔法师的毕生之着，记载着远古魔法师对法则的感悟与心得。 \n分类：2级魔法（职业）\n效果：用魔法将对方封印，有一定机率使目标在持续时间内无法使用魔法。 \n学习要求：\n法师：32级"
cn_636,蓝宝石项錬，静心宁神。
cn_637,弓形虽小，杀伤力不容小觑。
cn_638,"珍稀的魔法典籍，源自创世神蒂安的祝福，蕴含高等法则之力。 \n分类：4级魔法（职业）\n效果：有一定机率麻痹屏幕内的所有敌人。 \n学习要求：\n法师：40级"
cn_639,精心制作的高等皮革。
cn_640,"神秘的晶石，刻有精灵古文，蕴含着神奇的魔法力量！ \n分类：3级魔法（职业）\n效果：有一定机率将由召唤术或迷魅术得来的怪物释放掉。 \n学习要求：\n精灵：30级"
cn_641,长戟两端都有利刃，倒钩缠身，让人防不胜防。
cn_642,未经过加工的白金晶石。
cn_643,"珍稀的魔法手札，远古魔法师的毕生之着，记载着远古魔法师对法则的感悟与心得。 \n分类：2级魔法（职业）\n效果：利用大地之力对施法者周围一定范围内引发地震，使施法者周围1个单位内的敌人受到伤害。如果对玩家使用，需要打开pk开关。 \n学习要求：\n法师：32级"
cn_644,记载着奇怪咒语和符号的魔法书籍。
cn_645,王国士兵配备的通用铠甲。
cn_646,经过专业加工的奥钢金属板。
cn_647,"伊丁大陆上公开的魔法书籍，记录着初级魔法技能。 \n分类：1级魔法（普通）\n效果：瞬间移动到随机的位置，也可通过“传送控制戒指”传送到指定位置。 \n学习要求：\n王族：10级\n法师：4级\n精灵：8级\n骑士：50级"
cn_648,这是一把能斩杀魔物的好剑。
cn_649,"风晶石，源自月光女神的祝福，蕴含着轻灵的风属性力量！ \n分类：3级魔法（职业）\n效果：使目标提升6点远程命中。 \n学习要求：\n精灵：30级"
cn_650,"伊丁大陆上公开的魔法书籍，记录着初级魔法技能。 \n分类：1级魔法（普通）\n效果：用魔法召唤光源，照亮施法者周围，持续3600秒。 \n学习要求：\n王族：10级\n法师：4级\n精灵：8级\n骑士：10级"
cn_651,形似两片绿叶重叠，流水纹理，不乏美感。
cn_652,黑长者修炼魔法的方式比较奇特，他喜欢远行寻找魔法真谛，装备后魔力恢复增强。
cn_653,"珍稀的魔法典籍，源自创世神蒂安的祝福，蕴含高等法则之力。 \n分类：4级魔法（职业）\n效果：创造出一个持续时间为12秒的无敌保护屏障，为施法者抵挡住所有的攻击，期间若施放其他魔法则状态消失。 \n学习要求：\n法师：40级"
cn_654,经过简单提炼的秘银角块，可用来制作更强的武器，对不死系伤害加成。
cn_655,紫晶石项錬，深邃而睿智。
cn_656,轻薄的金属板，光泽亮丽。
cn_657,"珍贵的魔法书籍，蕴含着强大的神魔之力，记录着高级魔法技能。 \n分类：6级魔法（普通）\n效果：在目标的武器上施放魔法，提升对方的伤害以及命中。 \n学习要求：\n法师：24级\n精灵：48级"
cn_658,"珍贵的魔法书籍，蕴含着强大的神魔之力，记录着高级魔法技能。 \n分类：6级魔法（普通）\n效果：加速空间状态，使目标的速度提高，持续时间20分钟，效果不能叠加。 \n学习要求：\n法师：24级\n精灵：48级"
cn_659,"珍稀的魔法手札，远古魔法师的毕生之着，记载着远古魔法师对法则的感悟与心得。 \n分类：1级魔法（职业）\n效果：\n学习要求：\n法师：28级"
cn_660,平细长剑，光亮锋利，对不死系伤害加成。
cn_661,刻有传送魔法阵的卷轴，使用后传送至附近城镇。
cn_662,斯科特的巨眼，珍稀的高等材料。
cn_663,"水晶石，源自月光女神的祝福，蕴含着祥和的水属性力量！ \n分类：5级魔法（职业）\n效果：将已死亡的对象复活，使其体力值完全恢复，魔法值为0。 \n学习要求：\n精灵：50级"
cn_664,古怪的铁杖，特殊身份的象徵物。
cn_665,"骑士典籍，记录着骑士的格斗技巧，阐述着骑士的力量之源。 \n分类：2级魔法（职业）\n效果：使盔甲长出魔法尖刺，有机率另近身物理攻击者的武器受损。 \n学习要求：\n骑士：60级"
cn_666,坚硬耐磨的奥钢。
cn_667,"伊丁大陆上公开的魔法书籍，记录着初级魔法技能。 \n分类：2级魔法（普通）\n效果：在持续时间内增加自身负重值，能携带更多的道具。 \n学习要求：\n王族：20级\n法师：8级\n精灵：16级"
cn_668,"伊丁大陆上较为少见的魔法书籍，记录着中级魔法技能\n分类：3级魔法（普通）\n效果：用魔法判断出周围敌人所畏惧的属性类型。 \n学习要求：\n法师：12级\n精灵：24级"
cn_669,精灵制作的剑身，可用来制作更强的武器，对不死系伤害加成。
cn_670,"珍稀的魔法典籍，源自创世神蒂安的祝福，蕴含高等法则之力。 \n分类：3级魔法（职业）\n效果：\n学习要求：\n法师：36级"
cn_671,"巫师的魔法药剂洒落在这长袍上，有股非常难闻的怪味。\n激活套装后：魔力+50，土防+5。\n\f=套装组件含：头盔、斗篷"
cn_672,色泽鲜艳，口感爽脆，经常失眠，就是忘记吃它了。
cn_673,软质精灵皮盔。
cn_674,牢固的硬木夹克。
cn_675,"神秘的晶石，刻有精灵古文，蕴含着神奇的魔法力量！ \n分类：3级魔法（职业）\n效果：消耗自身45点体力值转换成为12点魔法值。 \n学习要求：\n精灵：30级"
cn_676,沉重的巨型战斧，采用精钢锻造而成。
cn_677,"伊丁大陆上较为少见的魔法书籍，记录着中级魔法技能\n分类：3级魔法（普通）\n效果：有一定的机率使不死系怪物立即毙命，但也有5%的机率使其进入狂暴状态。 \n学习要求：\n法师：12级\n精灵：24级"
cn_678,"巴风特变成恶魔之前，曾梦想成为身着战甲的英勇骑士。 \n效果：装备后有一定机率免疫石化状态。"
cn_679,"珍稀的魔法典籍，源自创世神蒂安的祝福，蕴含高等法则之力。 \n分类：4级魔法（职业）\n效果：召唤大量流星从天而降，使目标及其周围1个单位内的敌人受到极大的损伤。 \n学习要求：\n法师：40级"
cn_680,瓶内装着青色魔法药水，使用后可解除中毒状态。
cn_681,瓶内装着高浓度的魔法药水，使用后可恢复较多体力。
cn_682,"高贵的金丝护甲掩盖不了布伦丹贪婪的内心。\n激活套装后：变身布伦丹，防御-4，体力恢复-7。\n\f=套装组件含：头盔、盔甲、手套、鞋"
cn_683,"珍贵的魔法书籍，蕴含着强大的神魔之力，记录着高级魔法技能。 \n分类：5级魔法（普通）\n效果：恢复目标的较多体力值，也可对不死系怪物造成伤害。 \n学习要求：\n法师：20级\n精灵：40级"
cn_684,一种细长的纺织纤维。
cn_685,"厚实的皮制护盾。\n激活套装后：防御-3。\n\f=套装组件含：头盔、盔甲、鞋、盾牌"
cn_686,"珍稀的魔法手札，远古魔法师的毕生之着，记载着远古魔法师对法则的感悟与心得。 \n分类：1级魔法（职业）\n效果：用魔法召唤出强大旋风，对施法者周围2个单位内的所有敌人造成伤害。如果对玩家使用，需要打开pk开关。 \n学习要求：\n法师：28级"
cn_687,精灵族铁匠大师的十三件杰作之一，锻造之时，兽人族入侵精灵园林，战火纷扰，不得不中断锻造，仅完成剑身，可再次加工，制作出更强的武器，对不死系伤害加成。
cn_688,普通红宝石。
cn_689,"英勇骑士的钢铁之躯——手套。\n激活套装后：防御-3。\n\f=套装组件含：头盔、盔甲、手套、鞋、盾牌"
cn_690,红艳如火的佳品布料。
cn_691,一根头粗尾细的巨木棒，棒头还有几个突出的尖刺，十分危险。
cn_692,硬木大弓，外形可怕吓人。
cn_693,"土晶石，源自月光女神的祝福，蕴含着厚实的土属性力量！ \n分类：5级魔法（职业）\n效果：在持续时间内，使施法者加强10点防御力。 \n学习要求：\n精灵：50级"
cn_694,果皮光滑，果肉甚酸，有增强血管弹性和韧性的奇效。
cn_695,"伊丁大陆上公开的魔法书籍，记录着初级魔法技能。 \n分类：2级魔法（普通）\n效果：吸取目标少量体力值，并加入到自身体力中。 \n学习要求：\n王族：20级\n法师：8级\n精灵：16级"
cn_696,"采用上等橡木精心制作的法杖。"
cn_697,"带着我的盾凯旋，或者躺在上面归来。 \n——军团号角"
cn_698,"珍稀的魔法典籍，源自创世神蒂安的祝福，蕴含高等法则之力。 \n分类：4级魔法（职业）\n效果：使施法者与目标的位置互换。 \n学习要求：\n法师：40级"
cn_699,新手训练之用。
cn_700,"珍稀的魔法典籍，源自创世神蒂安的祝福，蕴含高等法则之力。 \n分类：3级魔法（职业）\n效果：在施法者周围引发火焰形成的风暴，对周围非蓝白敌人和怪物造成伤害。如果对玩家使用，需要打开pk开关。 \n学习要求：\n法师：36级"
cn_701,铁制头盔，内胆刻有吸收魔伤的防护魔法阵。每强化1级，魔防+1。
cn_702,"土晶石，源自月光女神的祝福，蕴含着厚实的土属性力量！ \n分类：4级魔法（职业）\n效果：为自己及同队伍成员加强7点防御力。 \n学习要求：\n精灵：40级"
cn_703,未经过加工的钢铁晶石。
cn_704,"珍贵的魔法书籍，蕴含着强大的神魔之力，记录着高级魔法技能。 \n分类：5级魔法（普通）\n效果：召唤出暗黑之影笼罩敌人，有一定机率使目标致盲，持续时间32秒。 \n学习要求：\n法师：20级\n精灵：40级"
cn_705,"在对超过安定值的装备使用后，该装备获得一个临时的保护状态，在保护状态下强化失败时，强化等级消失，装备不会消失。 \n注意：此保护状态在下一次强化时（无论成功或失败）或者物品转移时消失。"
cn_706,改良后的长弓，弓臂富有弹性。
cn_707,"土晶石，源自月光女神的祝福，蕴含着厚实的土属性力量！ \n分类：6级魔法（职业）\n效果：使施放者在超负重状态下仍可恢复体力值和魔法值。 \n学习要求：\n精灵：50级"
cn_708,碧若翠竹的卓越绿宝石。
cn_709,一本使用远古文字书写的神秘书籍。
cn_710,"布伦丹并不常戴软帽，这样会妨碍到他的视野。\n激活套装后：变身布伦丹，防御-4，体力恢复-7。\n\f=套装组件含：头盔、盔甲、手套、鞋"
cn_711,黑骑士军团的专用武器，黑骑士军团是阿提拉暴政的执行者！
cn_712,"皮制背心，护臂上的数根斜刺能有效的防止敌人近身。\n激活套装后：防御-3。\n\f=套装组件含：头盔、盔甲、盾牌、鞋"
cn_713,"珍稀的魔法手札，远古魔法师的毕生之着，记载着远古魔法师对法则的感悟与心得。 \n分类：1级魔法（职业）\n效果：恢复萤幕内队友和盟友的体力值。 \n学习要求：\n法师：28级"
cn_714,即使是精灵族的铁匠大师，遇上奥钢这样珍稀材料，也要先提炼锻造成角块，方便制作更强的武器，对不死系伤害加成。
cn_715,巨型斧刃，无坚不摧。
cn_716,小型护盾。
cn_717,"珍贵的魔法书籍，蕴含着强大的神魔之力，记录着高级魔法技能。 \n分类：5级魔法（普通）\n效果：召唤从天而降的闪电，对目标造成严重损害。 \n学习要求：\n法师：20级\n精灵：40级"
cn_718,这顶风之头盔已经残破不堪，蕴含的能量极不稳定，装备后能够施放加速魔法。
cn_719,"巫师非常注重帽子，他不想敌人看清他的面容。\n激活套装后：魔力+50，土防+5。\n\f=套装组件含：头盔、斗篷"
cn_720,这条力量项錬已经残破不堪，蕴含的能量极不稳定。
cn_721,上等红宝石。
cn_722,传说来自某国的一种刀剑，能够对敌人造成厉害的伤害。
cn_723,贵金属材料。
cn_724,奇幻的地属性斗篷，背衣上绣有大地绿野，装备后魔力恢复增强，提升土属性防御。
cn_725,"加拉哈德死后的力量来自无尽黑暗，他的双手已经沾满了活人的鲜血。\n激活套装后：变身死亡骑士，防御-4，体力恢复-7。\n\f=套装组件含：头盔、盔甲、手套、鞋"
cn_726,"神秘的晶石，刻有精灵古文，蕴含着神奇的魔法力量！ \n分类：1级魔法（职业）\n效果：在持续时间内，有一定机率反射魔法攻击。 \n学习要求：\n精灵：50级"
cn_727,舒适的新手皮凉鞋。
cn_728,精灵巧匠觉得传统的弓箭并不能击穿兽人厚皮，制作了这种穿透力强的复合弩弓。
cn_729,兽人卫兵配备的长矛。
cn_730,瓶内装着紫色魔法药水，使用后可获得二次自我加速，仅限骑士、王族使用。
cn_731,火龙的鳞片，散发着炽热的火之力。
cn_732,"火晶石，源自月光女神的祝福，蕴含着躁动的火属性力量！ \n分类：6级魔法（职业）\n效果：在持续时间内，有33%的机率提升1.5倍的近战物理攻击伤害。 \n学习要求：\n精灵：50级"
cn_733,"英勇骑士的钢铁之躯——铠甲。\n激活套装后：防御-3。\n\f=套装组件含：头盔、盔甲、手套、鞋、盾牌"
cn_734,写满魔法符文的监定卷轴，可监定属性。
cn_735,"伊丁大陆上公开的魔法书籍，记录着初级魔法技能。 \n分类：2级魔法（普通）\n效果：找出附近隐藏的怪物及玩家，使其显形。如果对玩家使用，需要打开pk开关。 \n学习要求：\n王族：20级\n法师：8级\n精灵：16级"
cn_736,这条体质项錬已经残破不堪，蕴含的能量极不稳定。
cn_737,"勇敢忠义，无愧吾王！ \n——红骑士宣言。\n激活套装后：防御-2，魔防+10。\n\f=套装组件含：头盔、斗篷、盾牌"
cn_738,经过专业加工的黄金金属板。
cn_739,"神秘的晶石，刻有精灵古文，蕴含着神奇的魔法力量！ \n分类：1级魔法（职业）\n效果：向目标同时射出三支箭，使敌人受到伤害，必须装备弓才能施放。敏捷≥25时可减免魔力，敏捷与智力取最大减免值作为减免计算，不可叠加减免。 \n学习要求：\n精灵：30级"
cn_740,这副手套所散发出来的魔法波动，和精灵有非常高的亲和度。
cn_741,"珍稀的魔法典籍，源自创世神蒂安的祝福，蕴含高等法则之力。 \n分类：4级魔法（职业）\n效果：瞬间移动施法者及其周围4个单位内的目标到随机位置，也可通过“传送控制戒指”传送到指定位置。 \n学习要求：\n法师：40级"
cn_742,"骷髅的骨骼早已经和生前穿戴的盔甲融合在一起。\n激活套装后：防御-2，体力+10。\n\f=套装组件含：头盔、盔甲、盾牌"
cn_743,奇幻的火属性斗篷，背衣如赤焰燃烧之状，装备后魔力恢复增强，提升火属性防御。
cn_744,形似弯月的刀刃。
cn_745,"伊丁大陆上较为少见的魔法书籍，记录着中级魔法技能\n分类：4级魔法（普通）\n效果：施放一个由魔法形成的保护屏障并围绕在身边，可以抵消一次魔法攻击，持续5秒。 \n学习要求：\n法师：16级\n精灵：32级"
cn_746,"水晶石，源自月光女神的祝福，蕴含着祥和的水属性力量！ \n分类：6级魔法（职业）\n效果：在持续时间内，目标第一次受到治癒魔法时有2倍效果。 \n学习要求：\n精灵：30级"
cn_747,猩红色的斗篷，艳红飘逸，毅力无限。
cn_748,内环刻有奇怪魔法阵的腰带。
cn_749,造型奇特的无锋短刀，似乎是举行某些仪式而用的木刀。
cn_750,洁白无暇的佳品布料。
cn_751,使用后，永久增加智力。
cn_752,"伊丁大陆上较为少见的魔法书籍，记录着中级魔法技能\n分类：4级魔法（普通）\n效果：吸取目标体力值，并加入到自身体力中。 \n学习要求：\n法师：16级\n精灵：32级"
cn_753,如刀似枪，砍杀四方。
cn_754,柔软的皮带背心。
cn_755,刻有传送魔法阵的卷轴，可随机传送到其他地方。
cn_756,厚实的铜制铠甲。
cn_757,"水晶石，源自月光女神的祝福，蕴含着祥和的水属性力量！ \n分类：4级魔法（职业）\n效果：利用水之力量保护目标，使目标提升5点远程闪避。 \n学习要求：\n精灵：40级"
cn_758,棕色的长筒软靴。
cn_759,"珍稀的魔法典籍，源自创世神蒂安的祝福，蕴含高等法则之力。 \n分类：3级魔法（职业）\n效果：用魔法改变对方形态，有一定机率将目标变形一段时间。 \n学习要求：\n法师：36级"
cn_760,"见识过布伦丹手套的人，已经在伊丁大陆上消失了。\n激活套装后：变身布伦丹，防御-4，体力恢复-7。\n\f=套装组件含：头盔、盔甲、手套、鞋"
cn_761,五彩斑斓的魔法宝石。
cn_762,奇幻的风系头盔，装备后能够施放加速魔法。
cn_763,"珍稀的魔法手札，远古魔法师的毕生之着，记载着远古魔法师对法则的感悟与心得。 \n分类：1级魔法（职业）\n效果：加强自己、同队伍及同公会成员的近战物攻5点，但会减弱10点防御力且会抵消加快体力值恢复速度的法术。 \n学习要求：\n法师：28级"
cn_764,"皇室秘典，承载着古往今来的王者之能！ \n分类：1级魔法（职业）\n效果：给自己及同队伍成员提升魔法防御及命中，效果会与钢铁士气相抵消。 \n学习要求：\n王族：40级"
cn_765,"皇室秘典，承载着古往今来的王者之能！ \n分类：1级魔法（职业）\n效果：加强自己、同队伍及同公会成员8点防御，效果会与激励士气相抵消。 \n学习要求：\n王族：55级"
cn_766,经过粗略加工的块状金属。
cn_767,诗蔻蒂的魔法软帽，装备后魔力恢复增强。
cn_768,德雷克的心脏，高等材料。
cn_769,普通的箭矢。
cn_770,果肉鲜嫩、甜美可口，多吃几个防衰老。
cn_771,蕴含神力的神秘卷轴，源自于玛丽亚神的信仰，可解除装备上的诅咒。
cn_772,"土晶石，源自月光女神的祝福，蕴含着厚实的土属性力量！ \n分类：3级魔法（职业）\n效果：有一定机率使目标移动速度降低25%。 \n学习要求：\n精灵：30级"
cn_773,"手中之剑，不凌弱小，所经之战，不畏强敌！ \n——红骑士宣言。"
cn_774,这条精神腰带已经残破不堪，蕴含的能量极不稳定。
cn_775,条款标注清晰的船票。
cn_776,柔软的皮制长靴。
cn_777,"珍稀的魔法典籍，源自创世神蒂安的祝福，蕴含高等法则之力。 \n分类：3级魔法（职业）\n效果：召唤出闪电及狂风，对目标及其周围1个单位内的敌人造成伤害。 \n学习要求：\n法师：36级"
cn_778,记载着防具研究心得的珍贵卷轴，可对防具进行强化升级。\n强化等级为6以上，与普通强化卷轴一样效果。
cn_779,普通蓝宝石。
cn_780,这条智力项錬已经残破不堪，蕴含的能量极不稳定。
cn_781,"风晶石，源自月光女神的祝福，蕴含着轻灵的风属性力量！ \n分类：6级魔法（职业）\n效果：有一定机率使目标在持续时间内完全丧失远程闪避。 \n学习要求：\n精灵：50级"
cn_782,精心铸造的银质箭矢。
cn_783,刻录着古老文字的皮带，散发着一股难以抗拒的灵魂之力。
cn_784,"柔软的皮制凉鞋。\n激活套装后：防御-3。\n\f=套装组件含：头盔、盔甲、鞋、盾牌"
cn_785,"风晶石，源自月光女神的祝福，蕴含着轻灵的风属性力量！ \n分类：6级魔法（职业）\n效果：在没有障碍物阻挡的前提下，可以立即移动到指定点。 \n学习要求：\n精灵：50级"
cn_786,"伊丁大陆上公开的魔法书籍，记录着初级魔法技能。 \n分类：1级魔法（普通）\n效果：将魔法笼罩全身形成保护层，加强自身2点防御力，效果不能叠加。 \n学习要求：\n王族：10级\n法师：4级\n精灵：8级\n骑士：30级"
cn_787,经过专业加工的秘银金属板。
cn_788,舒适的新手T恤。
cn_789,蕴含神力的神秘卷轴，源自于伏特神的信仰，可强化装备水属性。
cn_790,内斯特年轻时的作品，细腻的铸造手艺让这把弯刀更具有杀伤力。
cn_791,由小麦加工磨成的粉末。
cn_792,精灵铁匠大师的十三件杰作之首，据说此弓耗费大师十年时间才得以铸成，梵迪神感叹大师高超的锻造技术，亲自为此弓祝福，装备后可在无箭时射出魔法箭。
cn_793,"珍稀的魔法典籍，源自创世神蒂安的祝福，蕴含高等法则之力。 \n分类：3级魔法（职业）\n效果：为目标创造出一个强大的魔法保护屏障，使目标在持续时间内受到的伤害减半。 \n学习要求：\n法师：36级"
cn_794,伊丁大陆上常见的骑士头盔。
cn_795,尖刺长戟，刺入三分，血流不止。
cn_796,人类栽培较古老的农作物，吃完还能恶作剧。
cn_797,记载着武器研究心得的珍贵卷轴，可对武器进行强化升级
cn_798,"马洛斯是加拉哈德的最后战场，他的鲜血流入战甲之中，他的灵魂坠入黑暗深渊，带着毁灭和恐惧重生。\n激活套装后：变身死亡骑士，防御-4，体力恢复-7。\n\f=套装组件含：头盔、盔甲、手套、鞋"
cn_799,"当魔物重现伊丁之时，身穿亮银盔甲的英雄将会现身，守护伊丁大陆！ \n——银骑士传说"
cn_800,斯韦丹的魔法软帽。
cn_801,经过专业加工的白金金属板。
cn_802,索罗纳的魔法软帽，装备后魔力恢复增强。
cn_803,经过精灵祝福的魔抗短剑，对不死系伤害加成。
cn_804,新鲜的食人魔血液。
cn_805,"油布斗篷，领部扣有野兽长骨，能抵挡攻击。\n激活套装后：防御-3。\n\f=套装组件含：头盔、斗篷、盔甲、盾牌"
cn_806,"伊丁大陆上较为少见的魔法书籍，记录着中级魔法技能\n分类：4级魔法（普通）\n效果：投射炙热的火球灼烧敌人，使目标及其周围1个单位内的敌人受伤。 \n学习要求：\n法师：16级\n精灵：32级"
cn_807,恩多的魔法软帽。
cn_808,普通的双手剑，十分容易上手。
cn_809,"神秘的晶石，刻有精灵古文，蕴含着神奇的魔法力量！ \n分类：5级魔法（职业）\n效果：能召唤出一只与自身属性相对应的强力属性精灵。 \n学习要求：\n精灵：50级"
cn_810,亚瑟王为了顺利接管天堂，命人打造世间上最强武器，可惜这把武器并不能给他带来权力，亚瑟王最终被创世神封印在巴别塔内，末日之刃也随之销声匿迹。
cn_811,充满生命活力的树枝，可解除毒性并恢复血量。
cn_812,奇幻的魔法头盔，装备后能够施展通畅气脉术与加速术。
cn_813,"珍贵的魔法书籍，蕴含着强大的神魔之力，记录着高级魔法技能。 \n分类：6级魔法（普通）\n效果：以风之力吹散敌人的魔法，有一定机率清除目标身上所有魔法状态。 \n学习要求：\n法师：24级\n精灵：48级"
cn_814,冰冷坚硬的石块。
cn_815,刻有传送魔法阵的卷轴，可将同阵营玩家集体传送至附近城镇。
cn_816,瓶内装着黄色魔法药水，使用后可令集中力提高，增加魔法攻击力。
cn_817,由海洋之心炼化而成的魔力水晶球。
cn_818,斯科特的心脏，珍稀的高等材料。
cn_819,奇幻的手套，浮动着风系魔法波纹，装备后魔力恢复增强，提升风属性防御。
cn_820,"火晶石，源自月光女神的祝福，蕴含着躁动的火属性力量！ \n分类：3级魔法（职业）\n效果：使目标增加4点近战物理攻击力。 \n学习要求：\n精灵：30级"
cn_821,"珍贵的魔法书籍，蕴含着强大的神魔之力，记录着高级魔法技能。 \n分类：5级魔法（普通）\n效果：有一定的机率迷惑目标生物并使之跟随施法者，目标体力越低施法成功率越高。 \n学习要求：\n法师：20级\n精灵：40级"
cn_822,"珍稀的魔法典籍，源自创世神蒂安的祝福，蕴含高等法则之力。 \n分类：4级魔法（职业）\n效果：召唤出一场伴随着冰雪的飓风，对施法者周围5个单位内的敌人造成伤害并有一定机率冻结对方。 \n学习要求：\n法师：40级"
cn_823,"珍贵的魔法书籍，蕴含着强大的神魔之力，记录着高级魔法技能。 \n分类：5级魔法（普通）\n效果：有一定机率吸取目标的魔法值，并将部分魔法值转化为自身所有。 \n学习要求：\n法师：20级\n精灵：40级"
cn_824,"铠甲仅有护肩，中空铁环连接护腰，可随装备者体形调整盔甲大小。\n激活套装后：防御-3。\n\f=套装组件含：头盔、斗篷、盔甲、盾牌"
cn_825,称手的长矛。
cn_826,长柄战矛，开刃见血，对不死系伤害加成。
cn_827,天蓝软水晶制作而成的手套，装备后提升水属性防御。
cn_828,记载着魔法历程的古老书籍。
cn_829,经过专业加工的黑色秘银金属板。
cn_830,宽松的新手皮手套。
cn_831,特殊的魔法戒指，嵌合烈炎之晶，装备后提升火属性防御。
cn_832,内斯特的奇异想法很多，铸剑工艺十分了得，这把刀就是他的得意之作。
cn_833,碧水乳石，仿似翡翠。
cn_834,锋利的剑身，可用来制作更强的武器，对不死系伤害加成。
